HILLSBOROUGH,5278,BRIGHTER DAYS LLC,BRIGHTER DAYS-HWY 92,11825 E HIGHWAY 92,,SEFFNER,33584,8136814299,
HILLSBOROUGH,5278,BRIGHTER DAYS LLC,BRIGHTER DAYS-LAKEWOOD,119 S LAKEWOOD DR,,BRANDON,33511,8136844449,
HILLSBOROUGH,5278,BRIGHTER DAYS LLC,BRIGHTER DAYS-PARSONS,1502 N PARSONS AVE,,BRANDON,33510,8136854499,
HILLSBOROUGH,812,HILLSBOROUGH CTY BOCC,BUILDING BLOCKS HEAD START CENTER,2911 N 33RD STREET,,TAMPA,33605,8139557435,
HILLSBOROUGH,3369,"CARE-A-LOT CHILD CARE CENTER, INC.","CARE-A-LOT CHILD CARE CENTER, INC.",4002 W. HUMPHREY ST.,,TAMPA,336141914,8138888722,
HILLSBOROUGH,1458,CORNERSTONE FAMILY MINISTRIES,CASITA 4 KIDS LEARNING CENTER,7415 DESTIN DR,,TAMPA,33619,8139655287,
HILLSBOROUGH,1712,CASTLES OF IMAGINATION,CASTLES OF IMAGINATION,820 BRYAN RD,,BRANDON,335116102,8136892036,
HILLSBOROUGH,5357,CATHERINE'S EARLY LEARNING ACADEMY,CATHERINE'S EARLY LEARNING ACADEMY,11418 BLOOMINGDALE AVE,,RIVERVIEW,335783749,8133249083,
HILLSBOROUGH,6215,CFM - ROSA VALDEZ CENTER,CFM - ROSA VALDEZ CENTER,1802 N. ALBANY AVE.,,TAMPA,33607,8132533853,
HILLSBOROUGH,6215,CFM - ROSA VALDEZ CENTER,CFM ROSA VALDEZ CENTER AT OAK GROVE,2707 W WATERS AVENUE,,TAMPA,33614,8132533853,
HILLSBOROUGH,1458,CORNERSTONE FAMILY MINISTRIES,CHILDCARE OF BRANDON BROADWAY,11002 E BROADWAY AVENUE,,SEFFNER,33584,8136554855,
HILLSBOROUGH,1458,CORNERSTONE FAMILY MINISTRIES,CHILDREN OF THE WORLD ACADEMY I INC,6033 MEMORIAL HWY,,TAMPA,33615,8138856465,
HILLSBOROUGH,1458,CORNERSTONE FAMILY MINISTRIES,CHILDREN OF THE WORLD ACADEMY II,8731 JACKSON SPRINGS ROAD,,TAMPA,33615,8138855211,
HILLSBOROUGH,1458,CORNERSTONE FAMILY MINISTRIES,CHILDREN OF THE WORLD ACADEMY III,4901 N. HABANA AVENUE,,TAMPA,33614,8138767151,
HILLSBOROUGH,5547,"CHILDREN'S ACADEMY, INC.",CHILDREN'S ACADEMY,506 LIMONA RD.,,BRANDON,335102827,8136896820,
HILLSBOROUGH,1458,CORNERSTONE FAMILY MINISTRIES,CHILDREN'S LAND OF IMAGINATION ACADEMY,17409 GUNN HWY,,ODESSA,33556,8139262082,
HILLSBOROUGH,782,CHILDREN'S NEST DAY SCHOOL,CHILDREN'S NEST DAY SCHOOL,11504 N. 62ND STREET,,TEMPLE TERRACE,33617,8139856471,
HILLSBOROUGH,782,CHILDREN'S NEST DAY SCHOOL,CHILDREN'S NEST DAY SCHOOL,1311 MENDONSA ROAD,,PLANT CITY,33563,8137590605,
HILLSBOROUGH,782,CHILDREN'S NEST DAY SCHOOL,CHILDREN'S NEST DAY SCHOOL,15713 MAPLEDALE BLVD.,,TAMPA,33624,8139684235,
HILLSBOROUGH,782,CHILDREN'S NEST DAY SCHOOL,CHILDREN'S NEST DAY SCHOOL,3221 S. BRYAN RD.,,BRANDON,33511,8136850833,
HILLSBOROUGH,812,HILLSBOROUGH CTY BOCC,CHURCH PARK HEAD START,5657 WEBB ROAD,,TAMPA,33615,8139557240,
HILLSBOROUGH,5735,CITRUS PARK DAY SCHOOL,CITRUS PARK DAY SCHOOL,11112 HENDERSON RD,,TAMPA,336254960,8132643500,
HILLSBOROUGH,1458,CORNERSTONE FAMILY MINISTRIES,CITRUS PARK DAY SCHOOL NORTH,11602 HENDERSON ROAD,,TAMPA,33625,8132643500,
HILLSBOROUGH,1393,COLLEGE HILL COGIC PRESCHOOL,COLLEGE HILL COGIC PRESCHOOL,1002 E. MARTIN LUTHER KING BLVD,,TAMPA,336034312,8132318562,
HILLSBOROUGH,1458,CORNERSTONE FAMILY MINISTRIES,CREATIVE KIDZ LEARNING ACADEMY,6130 FLORENCE STREET,,GIBSONTON,33534,8136771300,
HILLSBOROUGH,5325,CREATIVE LEARNING ACADEMY,CREATIVE LEARNING ACADEMY,5557 WATERS AVE,,TAMPA,336341231,8138823382,
HILLSBOROUGH,6333,CREATIVE LEARNING ACADEMY ARMENIA,CREATIVE LEARNING ACADEMY ARMENIA,7912 N ARMENIA AVE,,TAMPA,336043807,8139333244,
HILLSBOROUGH,812,HILLSBOROUGH CTY BOCC,DEBORAH MCNAIR-CALHOUN HEAD START/EARLY HEAD START,2911 EAST HENRY STREET,,TAMPA,33610,8132733687,
HILLSBOROUGH,6655,DELORES M. SMITH ACADEMY OF TAMPA BAY INC,DELORES M. SMITH ACADEMY OF TAMPA BAY INC,2001 PINE LAKE DR,,TAMPA,336120000,8139159895,
HILLSBOROUGH,812,HILLSBOROUGH CTY BOCC,DELORIS MCCLOUD HEAD START,2103 N. ROME AVENUE,,TAMPA,33607,8132733688,
HILLSBOROUGH,1458,CORNERSTONE FAMILY MINISTRIES,DOMINION LIFE CHRISTIAN ACADEMY,9390 N FLORIDA AVE,,TAMPA,33612,8134502704,
HILLSBOROUGH,6260,DREAM CHASERS ACADEMY PRESCHOOL AND CHILDCARE,DREAM CHASERS ACADEMY PRESCHOOL AND CHILDCARE8,14324 N BOULEVARD,,TAMPA,336132010,8139646243,
HILLSBOROUGH,5968,EARLY SCHOLARS LEARNING ACADEMY,EARLY SCHOLARS LEARNING ACADEMY,9321 N ARMENIA AVE,,TAMPA,336127512,8132450056,
HILLSBOROUGH,5989,EARTH ANGELS LEARNING ACADEMY,EARTH ANGELS LEARNING ACADEMY,9714 N BOULEVARD,,TAMPA,336127846,8136447937,
HILLSBOROUGH,967,EASTSIDE PREPARATORY ACADEMY SCHOOL,EASTSIDE PREPARATORY ACADEMY SCHOOL,5708 ORIENT ROAD,,TAMPA,33610,8136284733,
HILLSBOROUGH,1458,CORNERSTONE FAMILY MINISTRIES,ECHO LEARNING CENTER BILINGUAL,6535 EAST HILLSBOROUGH AVE,,TAMPA,33610,8135138787,
HILLSBOROUGH,1458,CORNERSTONE FAMILY MINISTRIES,ECHO LEARNING CENTER BILINGUAL MONTESSORI,1420 W. BUSCH BLVD,,TAMPA,33612,8139311515,
HILLSBOROUGH,5572,"EDUCATED MINDS ACADEMY, INC.",EDUCATED MINDS ACADEMY,10025 W. HILLSBOROUGH AVE.,,TAMPA,336153000,8132430310,
HILLSBOROUGH,2677,"CHILD CARE OF SOUTHWEST FL., INC.",ELLIE'S SMALL WORLD LLC,3115 W LAMBRIGHT ST,,TAMPA,33614,8139320350,
HILLSBOROUGH,1458,CORNERSTONE FAMILY MINISTRIES,ELSA KIDS DAYCARE CENTER LLC,6315 W. CHELSEA ST.,,TAMPA,336346303,8138820226,
HILLSBOROUGH,6700,FAITH CHRISTIAN ACADEMY PRESCHOOL,FAITH CHRISTIAN ACADEMY PRESCHOOL,1202 S. COLLINS ST.,,PLANT CITY,335636512,8134732090,102
HILLSBOROUGH,1458,CORNERSTONE FAMILY MINISTRIES,FAMILY LOVING DAYCARE,9912 MYRTLE ST,,TAMPA,336174642,8139858515,
HILLSBOROUGH,1458,CORNERSTONE FAMILY MINISTRIES,FAT ALBERTS DAYCARE CENTER,4201 E. HANNA AVE.,,TAMPA,33610,8136269604,
HILLSBOROUGH,5009,FIRST DISCOVERIES ACADEMY,FIRST DISCOVERIES ACADEMY,1311 BROOKER ROAD,,BRANDON,335117625,8136629290,
HILLSBOROUGH,1458,CORNERSTONE FAMILY MINISTRIES,FOREST HILLS PRESBYTERIAN LEARNING CENTER,709 W. LINEBAUGH AVENUE,,TAMPA,33612,8139328789,
HILLSBOROUGH,5068,FREDDIE JEAN LEARNING ACADEMY 3,FREDDIE JEAN LEARNING ACADEMY 3,4215  N ORIENT RD,,TAMPA,336107223,8138589701,
HILLSBOROUGH,5961,GOLDEN RULE CHILD CARE CENTERS LLC,GOLDEN RULE CHILD CARE CENTERS LLC (GOLDEN RULE),104 GOLDEN RULE LANE,,PLANT CITY,335669408,8137541830,
HILLSBOROUGH,812,HILLSBOROUGH CTY BOCC,GRANT PARK HEAD START,4422 E. COLUMBUS DRIVE,,TAMPA,33605,8133844095,
HILLSBOROUGH,1458,CORNERSTONE FAMILY MINISTRIES,GREEN HOUSE LEARNING ACADEMY OF TAMPA,4121 W COMANCHE AVE,,TAMPA,33614,8134436107,
HILLSBOROUGH,1458,CORNERSTONE FAMILY MINISTRIES,HEAVEN SENT DAYCARE OF BRANDON,3003 S KINGS AVE,,BRANDON,33511,8136621865,
HILLSBOROUGH,69,"HELPING HAND DAY NURSERY, INC",HELPING HAND DAY NURSERY IV,12535 TINSLEY CIRCLE,,TAMPA,33612,8139108889,
HILLSBOROUGH,69,"HELPING HAND DAY NURSERY, INC","HELPING HAND DAY NURSERY, INC. II",6406 N 43RD ST,,TAMPA,33610,8136129690,
HILLSBOROUGH,5886,HERE WE GROW LEARNING CENTER,HERE WE GROW LEARNING CENTER,1211 WISHING WELL WAY,,TAMPA,336194747,8134998552,
HILLSBOROUGH,6157,HIGHER CALLING LEARNING ACADEMY,HIGHER CALLING LEARNING ACADEMY,808 E OKALOOSA AVE,,TAMPA,336041362,8134428570,
HILLSBOROUGH,1458,CORNERSTONE FAMILY MINISTRIES,HOME AWAY FROM HOME LEARNING CENTER 1,3002 S 78TH STREET,,TAMPA,33619,8136201379,
HILLSBOROUGH,1458,CORNERSTONE FAMILY MINISTRIES,JOYAS DEL FUTURO ACADEMY,7501 N HIMES AVE,,TAMPA,33614,8139329548,
HILLSBOROUGH,1458,CORNERSTONE FAMILY MINISTRIES,JUST FOR TOTS ACADEMY,4417 N. LOIS AVENUE,,TAMPA,33614,8135986865,
HILLSBOROUGH,1458,CORNERSTONE FAMILY MINISTRIES,KID CITY USA PLANT CITY,105 THRASHER ROAD,,PLANT CITY,33566,8134414824,
HILLSBOROUGH,1458,CORNERSTONE FAMILY MINISTRIES,KID'S COMMUNITY COLLEGE,10550 JOHANNA AVENUE,,RIVERVIEW,33578,8136710828,
HILLSBOROUGH,1458,CORNERSTONE FAMILY MINISTRIES,KID'S COMMUNITY COLLEGE RIVERVIEW SOUTH,10030 MATHOG ROAD,,RIVERVIEW,33578,8139992828,
HILLSBOROUGH,2866,KIDDIE ACADEMY OF CARROLLWOOD,KIDDIE ACADEMY OF CARROLLWOOD,15320 CASEY RD.,,TAMPA,336242309,8132642378,
HILLSBOROUGH,1458,CORNERSTONE FAMILY MINISTRIES,KIDDIE CAMPUS UNIVERSITY,111 MYRTLE RIDGE ROAD,,LUTZ,33549,8139094745,
HILLSBOROUGH,1458,CORNERSTONE FAMILY MINISTRIES,KIDDIE KOLLEGE BABY WORLD,4350 S MANHATTAN AVE,,TAMPA,33611,8138374477,
HILLSBOROUGH,1458,CORNERSTONE FAMILY MINISTRIES,KIDDIE KOLLEGE DAY CARE,4319 W FAIR OAKS AVE,,TAMPA,33611,8138374444,
HILLSBOROUGH,2574,KIDS CLUB EARLY LEARNING CENTER LLC,"KIDS CLUB EARLY LEARNING CENTER, LLC",608 N ALEXANDER ST,,PLANT CITY,335633038,8137526446,
HILLSBOROUGH,1458,CORNERSTONE FAMILY MINISTRIES,KIDS CORNER ACADEMY,3401 W COLUMBUS DR,,TAMPA,33607,8138702303,
HILLSBOROUGH,6183,KIDS COVE LEARNING ACADEMY,KIDS COVE LEARNING ACADEMY,12010 BALM RIVERVIEW RD,,RIVERVIEW,335696610,8136771443,
HILLSBOROUGH,5477,KIDS R TOPS,KIDS R TOPS,215 KINGSWAY RD,,BRANDON,335104603,8136542868,
HILLSBOROUGH,6205,KIDZ CLUB ACADEMY,KIDZ CLUB ACADEMY,1202 E SHELL POINT RD,,RUSKIN,335705004,8777335439,
HILLSBOROUGH,1458,CORNERSTONE FAMILY MINISTRIES,KIDZ IN PLAY CHILDCARE CENTER 2,4201 E OSBORNE AVE,,TAMPA,33610,8134433715,
HILLSBOROUGH,6425,KIDZ PLANET,KIDZ PLANET,606 E WINDHORST RD,,BRANDON,335102534,8133159327,
HILLSBOROUGH,812,HILLSBOROUGH CTY BOCC,KIMMINS EARLY HEAD START,1502 E. 2ND AVENUE,,TAMPA,33605,8132726128,
HILLSBOROUGH,277,KINDERCARE LEARNING CENTERS LLC,KINDERCARE LEARNING CENTER #300342,4934 WEBB RD,,TAMPA,33615,8138855519,
HILLSBOROUGH,277,KINDERCARE LEARNING CENTERS LLC,KINDERCARE LEARNING CENTER #301138,15609 PREMIERE DR,,TAMPA,33624,8139619172,
HILLSBOROUGH,277,KINDERCARE LEARNING CENTERS LLC,KINDERCARE LEARNING CENTER #301254,11501 N 53RD STREET,,TEMPLE TERRACE,33617,8139803188,
HILLSBOROUGH,277,KINDERCARE LEARNING CENTERS LLC,KINDERCARE LEARNING CENTER 300887,4250 GUNN HWY,,TAMPA,33618,8139632062,
HILLSBOROUGH,277,KINDERCARE LEARNING CENTERS LLC,KINDERCARE LEARNING CENTER 301139,4304 BELL SHOALS RD,,VALRICO,33596,8136540572,
HILLSBOROUGH,277,KINDERCARE LEARNING CENTERS LLC,KINDERCARE LEARNING CENTER PARSONS 301290,2524 S PARSONS AVE,,SEFFNER,33584,8136546492,
HILLSBOROUGH,277,KINDERCARE LEARNING CENTERS LLC,KINDERCARE LEARNING CENTER TIMBERLANE 301264,1701 WEST TIMBERLANE DRIVE,,PLANT CITY,33566,8137545264,
HILLSBOROUGH,3258,KING'S KIDS CHRISTIAN ACADEMY OF TAMPA,KING'S KIDS CHRISTIAN ACADEMY OF TAMPA INC.,3000 N. 34TH STREET,,TAMPA,336050019,8136661568,
HILLSBOROUGH,1458,CORNERSTONE FAMILY MINISTRIES,KRESTVIEW KID'S ACADEMY LLC,11425 BALM RIVERVIEW ROAD,,RIVERVIEW,33569,8134807126,
HILLSBOROUGH,1458,CORNERSTONE FAMILY MINISTRIES,L G LEARNING EXPRESS LLC,10302 N NEBRASKA AVE,,TAMPA,33612,8134886611,
HILLSBOROUGH,1348,LA PETITE ACADEMY,LA PETITE ACADEMY - RIVERVIEW,10025 CRISTINA DR,,RIVERVIEW,33569,8136712421,
HILLSBOROUGH,1348,LA PETITE ACADEMY,LA PETITE ACADEMY BLOOMINGDALE,808 W. BLOOMINGDALE AVE.,,BRANDON,33511,8136854332,
HILLSBOROUGH,1348,LA PETITE ACADEMY,LA PETITE ACADEMY GREENHOLLOW,1011 GREENHOLLOW LANE,,VALRICO,33596,8136843528,
HILLSBOROUGH,1348,LA PETITE ACADEMY,LA PETITE ACADEMY HUMPHREY,3818 W HUMPHREY ST,,TAMPA,33614,8139331687,
HILLSBOROUGH,1348,LA PETITE ACADEMY,LA PETITE ACADEMY MAPLEDALE,15707 MAPLEDALE BLVD.,,TAMPA,33624,8139624922,
HILLSBOROUGH,1348,LA PETITE ACADEMY,LA PETITE ACADEMY PAULA,7511 PAULA DRIVE,,TAMPA,33615,8138852215,
HILLSBOROUGH,1348,LA PETITE ACADEMY,LA PETITE ACADEMY REGENTS PARK,9005 REGENTS PARK DR,,TAMPA,336472460,8139734524,
HILLSBOROUGH,1348,LA PETITE ACADEMY,LA PETITE ACADEMY SOUTH VILLAGE,13502 S. VILLAGE DR.,,TAMPA,33618,8139623412,
HILLSBOROUGH,5189,LAKA CHILDCARE LLC,LAKA CHILDCARE LLC,4701 N 15TH ST,,TAMPA,336106004,8132312040,
HILLSBOROUGH,6660,LAND OF LEARNING ACADEMY,LAND OF LEARNING ACADEMY,8809 W ROBSON STREET,,TAMPA,336152314,8138866494,
HILLSBOROUGH,6468,LAUNCHPAD LEARNING CENTER INC,LAUNCHPAD LEARNING CENTER INC,1405 S SAINT CLOUD AVE,,VALRICO,335944747,8136577500,
HILLSBOROUGH,812,HILLSBOROUGH CTY BOCC,LEE DAVIS HEAD START CENTER,3402 NORTH 22ND STREET,,TAMPA,33605,8132725140,
HILLSBOROUGH,1458,CORNERSTONE FAMILY MINISTRIES,LIL PALS,1010 S 76TH ST,,TAMPA,336194702,8139196222,
HILLSBOROUGH,1458,CORNERSTONE FAMILY MINISTRIES,"LINDA'S LITTLE PEOPLE, INC.",1406 N WHEELER ST.,,PLANT CITY,335632358,8137528075,
HILLSBOROUGH,1458,CORNERSTONE FAMILY MINISTRIES,LITTLE EAGLES CHRISTIAN PRESCHOOL,2801 E 17TH AVE,,TAMPA,33605,8137703779,
HILLSBOROUGH,6184,LITTLE GIANTS LEARNING ACADEMY NORTH,LITTLE GIANTS LEARNING ACADEMY NORTH,10891 HACKNEY DR,,RIVERVIEW,335784341,8136726177,604
HILLSBOROUGH,6185,LITTLE GIANTS LEARNING ACADEMY SOUTH,LITTLE GIANTS LEARNING ACADEMY SOUTH,13250 US HWY 301 SOUTH,,RIVERVIEW,335789579,8136727541,601
HILLSBOROUGH,1458,CORNERSTONE FAMILY MINISTRIES,LITTLE HOUSE KINDER LEARNING CENTER,6333 MEMORIAL HIGHWAY,,TAMPA,336154537,8138866098,
HILLSBOROUGH,1458,CORNERSTONE FAMILY MINISTRIES,LITTLE LEARNERS ACADEMY OF TAMPA PHASE II,5240 EAST SLIGH AVENUE,,TAMPA,33617,8136444060,
HILLSBOROUGH,1458,CORNERSTONE FAMILY MINISTRIES,LITTLE STEPS LEARNING ACADEMY,8325 N PACKWOOD AVE,,TAMPA,33604,8139354322,
HILLSBOROUGH,1458,CORNERSTONE FAMILY MINISTRIES,LITTLE TEAM LEARNING ACADEMY,6929 N. MANHATTAN AVE.,,TAMPA,336143702,8134665585,
HILLSBOROUGH,1458,CORNERSTONE FAMILY MINISTRIES,LITTLE TOTS BUILDING BLOCKS ACADEMY,812 MAYDELL DRIVE,,TAMPA,33619,8133720202,
HILLSBOROUGH,1458,CORNERSTONE FAMILY MINISTRIES,LITTLE WONDERS LEARNING CENTER,7916 N HIMES AVE,,TAMPA,33614,8139320254,
HILLSBOROUGH,991,"LOLA'S CHILD CARE, INC.",LOLA'S CHILD CARE,4017 N. 34TH ST.,,TAMPA,336107828,8132370314,
HILLSBOROUGH,3197,"LOVE & GLORY LEARNING CENTER, INC.","LOVE & GLORY LEARNING CENTER, INC.",4911 N. 42ND STREET,,TAMPA,33610,8136646758,
HILLSBOROUGH,370,MACDILL CHILD DEVELOPMENT CENTER,MACDILL AFB SCHOOL AGE PROGRAM,2410 FLORIDA KEYS AVE.,,MACDILL AFB,33621,8138285971,
HILLSBOROUGH,370,MACDILL CHILD DEVELOPMENT CENTER,MACDILL CHILD DEVELOPMENT CENTER #3,8718 HANGAR LOOP DR,,MACDILL AFB,33621,8138280195,
HILLSBOROUGH,370,MACDILL CHILD DEVELOPMENT CENTER,MACDILL CHILD DEVELOPMENT CENTER (2),8660 HANGAR LOOP DR.,,MACDILL AFB,33621,8138282189,
HILLSBOROUGH,812,HILLSBOROUGH CTY BOCC,MANGO HEAD START/EARLY HEAD START,11210 E. BROADWAY AVE.,,SEFFNER,33584,8137445683,
HILLSBOROUGH,6330,MANIFESTATIONS EARLY CHILDCARE CENTER,MANIFESTATIONS EARLY CHILDCARE CENTER,3102 EAST LAKE AVENUE,,TAMPA,336107853,8132416919,
HILLSBOROUGH,6330,MANIFESTATIONS EARLY CHILDCARE CENTER,MANIFESTATIONS EARLY CHILDCARE CENTER EAST,2709 N 34TH ST,,TAMPA,33605,8132414453,23
HILLSBOROUGH,6605,"MARK OF EXCELLENCE ACADEMY, LLC","MARK OF EXCELLENCE ACADEMY, LLC",1905 LENNA AVE.,,SEFFNER,335845405,8136540789,
HILLSBOROUGH,5346,MILESTONE ACADEMY,MILESTONE ACADEMY,8801 N. 78TH STREET,,TEMPLE TERRACE,336377303,8139850019,
HILLSBOROUGH,5783,MORNING GLORY ACADEMY,MORNING GLORY ACADEMY,6001 CHRISTY LANE,,RIVERVIEW,335783931,8136280541,
HILLSBOROUGH,812,HILLSBOROUGH CTY BOCC,MOSI HEAD START & PRESCHOOL CENTER,4901 E. FOWLER AVENUE,,TAMPA,33617,8139876202,
HILLSBOROUGH,1458,CORNERSTONE FAMILY MINISTRIES,MOTHER GOOSE PRESCHOOL,3407 N HABANA AVE,,TAMPA,33607,8137605858,
HILLSBOROUGH,5684,MY LITTLE GIANTS  DAY SCHOOL,MY LITTLE GIANTS DAY SCHOOL,6503 N. HIMES AVE.,,TAMPA,336144027,8139358088,
HILLSBOROUGH,1458,CORNERSTONE FAMILY MINISTRIES,NEW HEAVEN LEARNING CENTER,16246 SAGEBRUSH RD,,TAMPA,33618,8139692471,
HILLSBOROUGH,6685,"NEXT GENERATION KIDZ EARLY CHILDHOOD LEARNING CENTER 2, INC.","NEXT GENERATION KIDZ EARLY CHILDHOOD LEARNING CENTER 2, INC.",3211 SANCHEZ STREET,,TAMPA,336051850,8135155539,
HILLSBOROUGH,6693,NEXT GENERATION KIDZ EARLY CHILDHOOD LEARNING CENTER 3 INC,NEXT GENERATION KIDZ EARLY CHILDHOOD LEARNING CENTER 3 INC,6815 E 21ST AVE,,TAMPA,336191800,8134153150,
HILLSBOROUGH,6701,NEXT GENERATION KIDZ EARLY CHILDHOOD LEARNING INC,NEXT GENERATION KIDZ EARLY CHILDHOOD LEARNING INC,1207 E JUNEAU ST,,TAMPA,336043254,8139316392,
HILLSBOROUGH,1458,CORNERSTONE FAMILY MINISTRIES,NEXT JEN'ERATION KIDS ACADEMY,410 S COLLINS STREET,,PLANT CITY,33563,8137070337,
HILLSBOROUGH,812,HILLSBOROUGH CTY BOCC,NORTH TAMPA COMMUNITY HEAD START CENTER,14013 N. 22ND AVENUE,,TAMPA,33613,8139033492,
HILLSBOROUGH,812,HILLSBOROUGH CTY BOCC,NYE PARK HEAD START CENTER,630 SUNSET LANE,,LUTZ,33549,8139032206,
HILLSBOROUGH,6435,O2B KIDS RIVERVIEW,O2B KIDS RIVERVIEW,11616 BOYETTE RD,,RIVERVIEW,335695681,8138075437,
HILLSBOROUGH,6716,O2B KIDS SOUTH CREEK,O2B KIDS SOUTH CREEK,10471 ALDER GREEN DRIVE,,RIVERVIEW,335786276,8137389900,
HILLSBOROUGH,6068,PANDA HUGS ACADEMY,PANDA HUGS ACADEMY,15051 BRUCE B. DOWNS BLVD,,TAMPA,336471388,8139778195,
HILLSBOROUGH,1458,CORNERSTONE FAMILY MINISTRIES,PARADISE LEARNING CENTER,5605 NORTH LINCOLN AVE.,,TAMPA,336145809,8138752664,
HILLSBOROUGH,1458,CORNERSTONE FAMILY MINISTRIES,PARADISE LEARNING CENTER II,1205 W. HILLSBOROUGH AVE.,,TAMPA,33603,8132372100,
HILLSBOROUGH,1458,CORNERSTONE FAMILY MINISTRIES,PARADISE LEARNING CENTER III,820 W DR MARTIN LUTHER KING BLVD,,TAMPA,336030000,8132252608,
HILLSBOROUGH,1458,CORNERSTONE FAMILY MINISTRIES,PARADISE LEARNING CENTER IV,8012 N ARMENIA AVE,,TAMPA,33604,8134884183,
HILLSBOROUGH,1458,CORNERSTONE FAMILY MINISTRIES,PARADISE LEARNING CENTER V,6704 N HIMES AVE,,TAMPA,33614,8138789033,
HILLSBOROUGH,1458,CORNERSTONE FAMILY MINISTRIES,PINECREST MIRNIA'S ACADEMY,6605 N HALE AVE,,TAMPA,33614,8138846795,
HILLSBOROUGH,1458,CORNERSTONE FAMILY MINISTRIES,PINOCCHIO LEARNING CENTER INC.,3303 W ST LOUIS ST,,TAMPA,33607,8138759988,
HILLSBOROUGH,6692,PLANT CITY EARLY LEARNING ACADEMY,PLANT CITY EARLY LEARNING ACADEMY,503 N PALMER ST,,PLANT CITY,335633439,8134455254,
HILLSBOROUGH,812,HILLSBOROUGH CTY BOCC,PLANT CITY HEAD START CENTER,1304 ALSOBROOK STREET,,PLANT CITY,33563,8137573845,
HILLSBOROUGH,6796,PLANT CITY LEARNING CENTER,PLANT CITY LEARNING CENTER,651 E ALEXANDER STREET,,PLANT CITY,335637126,8137526481,
HILLSBOROUGH,2734,PLAY 'N' LEARN CHILDRENS DEV. CTR.,PLAY 'N' LEARN CHILDRENS DEVELOPMENT CENTER,14706 N. BOULEVARD,,TAMPA,33613,8139616475,
HILLSBOROUGH,4368,PRECIOUS GEMS ACADEMY INC,PRECIOUS GEMS ACADEMY INC,736 MARTIN LUTHER KING BLVD,,SEFFNER,335844534,8133248950,
HILLSBOROUGH,1458,CORNERSTONE FAMILY MINISTRIES,PRECIOUS ONES LEARNING CENTER,5810 N HALE AVE,,TAMPA,33614,8138841843,
HILLSBOROUGH,1458,CORNERSTONE FAMILY MINISTRIES,PROGRESS VILLAGE CHRISTIAN ACADEMY,8616 PROGRESS BLVD,,TAMPA,33619,8136775988,
HILLSBOROUGH,1458,CORNERSTONE FAMILY MINISTRIES,RAINBOW KIDS CHILD CARE CENTER,4124 W WATERS AVE,,TAMPA,33614,8139015368,
HILLSBOROUGH,1458,CORNERSTONE FAMILY MINISTRIES,RAINBOW OF KIDS ACADEMY,2708 N CENTRAL AVE,,TAMPA,33602,8132232798,
HILLSBOROUGH,6372,RAMOS LEARNING INC,RAMOS LEARNING INC,2118 N MACDILL AVE,,TAMPA,336073226,8138732244,
HILLSBOROUGH,557,REDLANDS CHRISTIAN MIG. ASSOC.,RCMA  BALM CHILD DEVELOPMENT CENTER,14710 SWEET CHARLIE CIRCLE,,WIMAUMA,33598,8136725332,
HILLSBOROUGH,557,REDLANDS CHRISTIAN MIG. ASSOC.,RCMA BETHEL CHILD DEVELOPMENT CENTER (1),18240A  SOUTH HIGHWAY 301,,WIMAUMA,33598,8136725165,
HILLSBOROUGH,557,REDLANDS CHRISTIAN MIG. ASSOC.,RCMA DOVER CDC,3103 SAN JOSE MISSION DR BLDG. 1,,DOVER,33527,8137077002,
HILLSBOROUGH,557,REDLANDS CHRISTIAN MIG. ASSOC.,RCMA DOVER CDC II,3103 SAN JOSE MISSION DR BLDG 2,,DOVER,33529,8137077048,
HILLSBOROUGH,557,REDLANDS CHRISTIAN MIG. ASSOC.,RCMA GROVE POINTE CHILD DEVELOPMENT CENTER,129 LAGUNA OAKS PLACE,,RUSKIN,33570,8136715283,
HILLSBOROUGH,557,REDLANDS CHRISTIAN MIG. ASSOC.,RCMA LA ESTANCIA CHILD DEVELOPMENT CENTER(5),5292 GUADALUPE BLVD.,,WIMAUMA,33598,8136715285,
HILLSBOROUGH,557,REDLANDS CHRISTIAN MIG. ASSOC.,RCMA PLANT CITY CHILD DEVELOPMENT CENTER (39),1402 W. KNIGHTS GRIFFIN RD.,,PLANT CITY,335655279,8137077011,
HILLSBOROUGH,557,REDLANDS CHRISTIAN MIG. ASSOC.,RCMA RUSKIN INFANT CHILD DEV. CENTER (43),209  14TH AVE SE,,RUSKIN,335700000,8136715281,
HILLSBOROUGH,557,REDLANDS CHRISTIAN MIG. ASSOC.,RCMA SAM ALLEN CHILD DEVELOPMENT CENTER,2701 DE MONTMOLLIN RD,,PLANT CITY,33565,8137163332,
HILLSBOROUGH,557,REDLANDS CHRISTIAN MIG. ASSOC.,RCMA WIMAUMA EARLY EDUCATION CDC (65),5610 DESOTO ST.,,WIMAUMA,33598,8136715278,
HILLSBOROUGH,557,REDLANDS CHRISTIAN MIG. ASSOC.,RCMA WIMAUMA GROVES CDC (67),5316-A - SUN PARADISE COURT,,WIMAUMA,33598,8136725322,
HILLSBOROUGH,557,REDLANDS CHRISTIAN MIG. ASSOC.,RCMA WIMAUMA SCHOOL AGE PROGRAM (66),5705 HILLSBOROUGH ST.,,WIMAUMA,33598,8136717715,
HILLSBOROUGH,1458,CORNERSTONE FAMILY MINISTRIES,RIVERVIEW BIG BEND DBA KID CITY USA RIVERVIEW,11329 BIG BEND ROAD,,RIVERVIEW,33579,8134153988,
HILLSBOROUGH,812,HILLSBOROUGH CTY BOCC,ROBLES PARK HEAD START CENTER,3814 NORTH CENTRAL AVENUE,,TAMPA,33603,8132726448,
HILLSBOROUGH,6008,ROSE ACADEMY OF ACHIEVERS,ROSE ACADEMY OF ACHIEVERS,4108 E ELLICOTT ST,,TAMPA,336102208,8139406605,
HILLSBOROUGH,6103,SAFE AND SOUND LEARNING CENTER LLC,SAFE AND SOUND LEARNING CENTER LLC,8516 RIDEIN RD,,TAMPA,336194943,8136264400,
HILLSBOROUGH,934,SAFETY-LAND DAY NURSERY & KINDERGARTEN,SAFETYLAND DAY NURSERY & KINDERGARTEN,13122 N 15TH ST,,TAMPA,336123702,8139713954,
HILLSBOROUGH,1458,CORNERSTONE FAMILY MINISTRIES,SANDRA THOMAS FAMILY ENRICHMENT CENTER,1924 E COMANCHE AVE,,TAMPA,33610,8134428555,
HILLSBOROUGH,1458,CORNERSTONE FAMILY MINISTRIES,SANDY'S LEARNING CENTER,15923 N FLORIDA AVE,,LUTZ,335496100,8139615209,
HILLSBOROUGH,1458,CORNERSTONE FAMILY MINISTRIES,SEE SAW JUNCTION LEARNING CENTER,6812 N DIXON AVE,,TAMPA,33604,8132370169,
HILLSBOROUGH,1458,CORNERSTONE FAMILY MINISTRIES,SEE SAW JUNCTION LEARNING CENTER II,8720 N 40TH STREET,,TAMPA,336042432,8139872606,
HILLSBOROUGH,1458,CORNERSTONE FAMILY MINISTRIES,SEFFNER EARLY CHILDHOOD DEVELOPMENT CENTER,205 E HIGHWAY 92,,SEFFNER,33584,8134388964,
HILLSBOROUGH,2864,SHINING STARS PRESCHOOL ACADEMY INC,"SHINING STARS PRESCHOOL ACADEMY, INC.",603 E. MORGAN ST.,,BRANDON,335104606,8136616988,
HILLSBOROUGH,5274,DAY CARES OF FLORIDA LLC,SIMMONS CHILD WORLD,107 E CLAY AVE,,BRANDON,33510,8136893453,
HILLSBOROUGH,2511,SMART KIDS ACADEMY LLC,SMART KIDS ACADEMY LLC,3512 WEST BAKER ST.,,PLANT CITY,335630000,8137544880,
HILLSBOROUGH,2937,SMART START PRE-PREP,SMART START PRE-PREP,13801 MCCORMICK DR.,,TAMPA,336263017,8138557333,203
HILLSBOROUGH,1458,CORNERSTONE FAMILY MINISTRIES,SMART STEPS LLC,9653 WILSKY BLVD,,TAMPA,33615,8139646233,
HILLSBOROUGH,812,HILLSBOROUGH CTY BOCC,SOUTH COUNTY HEADSTART CENTER,215 SE 14TH AVENUE,,RUSKIN,33570,8136717662,
HILLSBOROUGH,6471,STARFISH SCHOLARS OF VALRICO,STARFISH SCHOLARS OF VALRICO,4321 LYNX PAW TRAIL,,VALRICO,335967426,8136576200,
HILLSBOROUGH,5097,STEAM PRESCHOOL ACADEMY AT NETPARK TAMPA BAY,STEAM PRESCHOOL ACADEMY AT NETPARK TAMPA BAY,5015 N 56 ST,,TAMPA,336105420,8136211193,
HILLSBOROUGH,6223,STEAM PRESCHOOL ACADEMY OF PLANT CITY,STEAM PRESCHOOL ACADEMY OF PLANT CITY,1108 GOLDFINCH DR,,PLANT CITY,335631081,8136528265,
HILLSBOROUGH,5556,STEP AHEAD ACADEMY,STEP AHEAD ACADEMY,308 E. 124TH AVE.,,TAMPA,336124305,8139337416,
HILLSBOROUGH,1170,STEPS TO MATURITY LEARNING CTR.,STEPS TO MATURITY L.C. & BABY STEPS/EARLY STEPS,9506-9508 N. NEBRASKA AVE.,811 S. CASTLE COURT,TAMPA,336128027,8139322933,
HILLSBOROUGH,1458,CORNERSTONE FAMILY MINISTRIES,STRAWBERRY CREST EARLY CHILDHOOD DEV CENTER INC,3802 GALLAGHER RD,,PLANT CITY,33565,8139821330,
HILLSBOROUGH,812,HILLSBOROUGH CTY BOCC,STRAWBERRY HILLS HEAD START/EARLY HEAD START,701 TILLMAN PLACE,,PLANT CITY,33566,8137573934,
HILLSBOROUGH,1123,"SUNRISE CHILDREN'S SERVICES, INC.","SUNRISE CHILDREN'S SERVICES, INC.",1114 W SLIGH AVENUE,,TAMPA,336045935,8132391179,14148
HILLSBOROUGH,1629,SUNSHINE CHILDREN'S LEARNING CENTER,SUNSHINE CHILDREN'S LEARNING CENTER,4405 KELLY ROAD,,TAMPA,33615,8138845326,
HILLSBOROUGH,1629,SUNSHINE CHILDREN'S LEARNING CENTER,"SUNSHINE CHILDREN'S LEARNING CENTER, LLC",3923 W. BAY AVENUE,,TAMPA,33616,8138397301,
HILLSBOROUGH,6563,SUNSHINE DAYCARE OF TAMPA LLC,"SUNSHINE DAYCARE OF TAMPA, LLC","8401 W HILLSBOROUGH AVE, SUITE 2",,TAMPA,336153807,8134022069,
HILLSBOROUGH,1458,CORNERSTONE FAMILY MINISTRIES,TAMPA COMMUNITY CENTER,1725 E FLOWLER AVE,,TAMPA,33612,8135247070,
HILLSBOROUGH,1458,CORNERSTONE FAMILY MINISTRIES,TAMPA ELITE SPORTS ACADEMY,8001 SHELDON RD.,,TAMPA,33615,8134435067,
HILLSBOROUGH,812,HILLSBOROUGH CTY BOCC,TAMPA HEIGHTS HEAD START/EARLY HEAD START CENTER,175 E FRANCES ST,,TAMPA,33602,8132725140,
HILLSBOROUGH,1458,CORNERSTONE FAMILY MINISTRIES,THE ACADEMY AT TRUE SANCTUARY OF PRAISE,"6528 S US HWY 301, #114",,RIVERVIEW,335780000,8133195862,
HILLSBOROUGH,3869,THE GROWING TREE ACADEMY,THE GROWING TREE ACADEMY,8718 S. MOBLEY RD.,,TAMPA,336261505,8139209367,
HILLSBOROUGH,1458,CORNERSTONE FAMILY MINISTRIES,THE PEACOCK'S PLUME COMPANY,1094 BLOOMINGDALE AVENUE,,VALRICO,33596,8136840700,
HILLSBOROUGH,1458,CORNERSTONE FAMILY MINISTRIES,TINY FEET LEARNING ACADEMY,"7902 W WATERS AVE, SUITE K",,TAMPA,33615,8138897777,
HILLSBOROUGH,1458,CORNERSTONE FAMILY MINISTRIES,TOGETHER TIME,15306 CASEY RD.,,TAMPA,33624,8139621733,
HILLSBOROUGH,6057,TOP KIDS BILINGUAL PRESCHOOL,TOP KIDS BILINGUAL PRESCHOOL,"6701 S MANHATTAN AVE, STE D",,TAMPA,336161413,8134427485,
HILLSBOROUGH,6379,TOP KIDS BILINGUAL PRESCHOOL 7,TOP KIDS BILINGUAL PRESCHOOL 7,3805 JOHN MOORE DR,,BRANDON,335117844,8135733774,
HILLSBOROUGH,6647,TOP KIDS BILINGUAL PRESCHOOL MACDILL CAMPUS,TOP KIDS BILINGUAL PRESCHOOL MACDILL CAMPUS,6807 S MACDILL AVENUE,,TAMPA,336115502,8133743037,
HILLSBOROUGH,6056,TOP KIDS BILINGUAL PRESCHOOL RIVERVIEW,TOP KIDS BILINGUAL PRESCHOOL RIVERVIEW,10530 LAKE ST CHARLES BLVD,,RIVERVIEW,335684595,8138710624,
HILLSBOROUGH,1458,CORNERSTONE FAMILY MINISTRIES,TOP KIDS PRESCHOOL 5,202 E BROAD STREET,,TAMPA,33604,8134436441,
HILLSBOROUGH,812,HILLSBOROUGH CTY BOCC,TOWN AND COUNTRY COMMONS HEADSTART,"7606 PAULA DRIVE, #110",,TAMPA,33615,8135545096,
HILLSBOROUGH,6252,TWO STEPS AHEAD EARLY LEARNING CENTER,TWO STEPS AHEAD EARLY LEARNING CENTER LLC,3905 E REGNAS AVE,,TAMPA,336042419,8139149543,
HILLSBOROUGH,6764,VANGUARD KIDS,VANGUARD KIDS,12660 SYDNEY RD,,DOVER,335275957,8135300032,
HILLSBOROUGH,3931,WEST TAMPA EARLY LEARNING CENTER LLC,WEST TAMPA EARLY LEARNING CENTER LLC,3812 1/2 N ARMENIA AVE,,TAMPA,336071306,8138730473,
HILLSBOROUGH,4061,WINDSOR LEARNING ACADEMY,WINDSOR LEARNING ACADEMY,6920 HANLEY RD,,TAMPA,336343542,8132431911,
