2/5/25,,,,,,,,,
County,Auth #,Organization Name,Center Name,Address,Address 2,City,Zip,Phone,Extension
ALACHUA,1882,"CHILDHOOD DEVELOPMENT SERVICES, INC",A HIDDEN CHILD'S WORLD,3237 SW  41ST PLACE,,GAINESVILLE,32608,3523786343,
ALACHUA,2592,A WORLD OF ANGELS OF  GAINESVILLE INC,A WORLD OF ANGELS OF GAINESVILLE,1119 N.W. 42ND AVENUE,,GAINESVILLE,32609,3523810080,
ALACHUA,1882,"CHILDHOOD DEVELOPMENT SERVICES, INC",ABACUS LEARNING CENTER,5205 SW 91ST DR,,GAINESVILLE,32608,8137894015,
ALACHUA,3383,ANGELS CHRISTIAN ACADEMY,ANGEL'S CHRISTIAN ACADEMY,1805 SE HAWTHORNE RD,,GAINESVILLE,326417434,3523748521,
ALACHUA,3460,ANGELIC BLESSINGS ACADEMY,ANGELIC BLESSINGS ACADEMY,2022 SW 122ND ST BLDG B,,GAINESVILLE,326071030,3526638778,
ALACHUA,6309,ANGELS FAITH LEARNING CENTER LLC,ANGELS FAITH LEARNING CENTER LLC,2500 NE 15TH STREET,,GAINESVILLE,326095105,3527926300,
ALACHUA,6161,BUILDING DREAMS EARLY LEARNING CENTER L.L.C.,BUILDING DREAMS EARLY LEARNING CENTER L.L.C.,18467 NW US HWY 441 SUITE 10,,HIGH SPRINGS,326438795,3864540771,
ALACHUA,5600,CHILD CENTER FOR EARLY LEARNING,CHILD CENTER FOR EARLY LEARNING,820 SW 62ND TERRACE,,GAINESVILLE,326073612,3525191345,
ALACHUA,583,"EPISCOPAL CHILDREN'S SERVICES, INC.",ECS GAINESVILLE EARLY HEAD START/HEAD START,530 NE WALDO RD,,GAINESVILLE,32641,3526726979,
ALACHUA,583,"EPISCOPAL CHILDREN'S SERVICES, INC.",EPISCOPAL CHILDREN'S SERVICE HIGHLANDS HEAD START,1132 NE 16TH AVENUE,,GAINESVILLE,32601,3525545005,
ALACHUA,583,"EPISCOPAL CHILDREN'S SERVICES, INC.",EPISCOPAL CHILDREN'S SERVICES EASTSIDE HEAD START,1930 NE WALDO ROAD,,GAINESVILLE,32609,3522644023,
ALACHUA,583,"EPISCOPAL CHILDREN'S SERVICES, INC.",EPISCOPAL CHILDREN'S SERVICES HAWTHORNE HEAD START/EARLY HEAD START,5837 SE US HIGHWAY 301,,HAWTHORNE,32640,3524811908,
ALACHUA,583,"EPISCOPAL CHILDREN'S SERVICES, INC.","EPISCOPAL CHILDREN'S SERVICES, INC. EDEN PARK HEAD START",1340 NE 39TH AVENUE,,GAINESVILLE,32060,3525544063,
ALACHUA,6658,GAINESVILLE EMPOWERMENT ZONE FAMILY LEARNING CENTER,GAINESVILLE EMPOWERMENT ZONE FAMILY LEARNING CENTER,1250 NE 18TH AVE BLDG 11,,GAINESVILLE,326093893,3522253931,
ALACHUA,5785,GRANNY D'S LEARNING CENTER,GRANNY D'S LEARNING CENTER,901 SE 1ST AVE,,GAINESVILLE,326016918,3528725852,
ALACHUA,6261,HAGIOS EARLY LEARNING CENTER LLC,HAGIOS EARLY LEARNING CENTER LLC,1704 NE 9TH STREET,,GAINESVILLE,326093730,3522604477,
ALACHUA,1418,HEAVENLY KIDS ACADEMY,HEAVENLY KIDS ACADEMY,309 N.E. 39TH AVE.,,GAINESVILLE,326091722,3523728200,
ALACHUA,6370,I RISE PERFORMING KIDS ACADEMY,I RISE PERFORMING KIDS ACADEMY,24621 DOC KARELAS DR,,NEWBERRY,326693219,3526602013,
ALACHUA,1882,"CHILDHOOD DEVELOPMENT SERVICES, INC",KIDZ R KIDZ LEARNING ACADEMY INC,1735 SE HAWTHORNE RD,,GAINESVILLE,32641,3525545209,
ALACHUA,1348,LA PETITE ACADEMY,LA PETITE ACADEMY (ARCHER RD.),2755 S.W. ARCHER RD.,,GAINESVILLE,32608,3523710720,
ALACHUA,1387,LEE'S FUN TO LEARN DAYCARE & TUTORING INC,"LEE'S FUN TO LEARN DAYCARE & TUTORING, INC.",18129  DOUGLASS ST,,HIGH SPRINGS,326434281,3864545568,
ALACHUA,1882,"CHILDHOOD DEVELOPMENT SERVICES, INC",LIL SCHOLARS LEARNING ACADEMY INC,3520 N.W. 13TH ST.,,GAINESVILLE,32609,3525195552,
ALACHUA,1363,LITTLE ANGELS CHILD CARE & LEARNING CTR.,LITTLE ANGELS CHILD CARE & LEARNING CENTER,14821 NW US HWY. 441,,ALACHUA,326158203,3864182211,
ALACHUA,163,MARTIN-ROCHELLE LEARNING CENTER INC,MARTIN-ROCHELLE LEARNING CENTER INC,13645 SW STATE RD 45,,ARCHER,326184087,3524959346,
ALACHUA,4879,NANNY'S LOVING ARMS EARLY LEARNING ACADEMY,NANNY'S LOVING ARMS EARLY LEARNING ACADEMY,5000 NW 34TH BLVD SUITE 17,,GAINESVILLE,326051187,3527457217,
ALACHUA,6565,O2B KIDS COLLEGE 2,O2B KIDS COLLEGE 2,4929 SW 43RD ST,,GAINESVILLE,326064460,3523714202,
ALACHUA,4595,O2B KIDS COLLEGE 3 LTD,O2B KIDS COLLEGE 3 LTD,3989 SW 37TH BLVD,,GAINESVILLE,326088454,3523788838,
ALACHUA,4596,O2B KIDS COLLEGE 4,O2B KIDS COLLEGE 4,1555 NW 23RD  AVE,,GAINESVILLE,326053018,3523742202,
ALACHUA,4597,O2B KIDS COLLEGE 6 LTD,O2B KIDS COLLEGE 6 LTD,14400 NW 152ND LANE,,ALACHUA,326158606,3864620092,
ALACHUA,6346,O2B KIDS NEWBERRY PARK,O2B KIDS NEWBERRY PARK,12186 NW 7TH PLACE,,GAINESVILLE,326074803,3526645437,
ALACHUA,4593,OH TO BE KIDS,OH TO BE KIDS,7383 SW 17TH ROAD,,GAINESVILLE,326070000,3523325500,
ALACHUA,907,ORANGE BLOSSOM PREP,ORANGE BLOSSOM PREP,6200 S.W. ARCHER RD.,,GAINESVILLE,32608,3523758900,
ALACHUA,1882,"CHILDHOOD DEVELOPMENT SERVICES, INC",RISING STAR EDUCATIONAL ACADEMY INC #1,1938 NE WALDO RD,,GAINESVILLE,32609,3523843900,
ALACHUA,21,SANTA FE COLLEGE LITTLE SCHOOL,SANTA FE COLLEGE LITTLE SCHOOL,3000 N.W. 83 ST.,,GAINESVILLE,326066210,3523955599,
ALACHUA,1882,"CHILDHOOD DEVELOPMENT SERVICES, INC","SMALL STEPS INSTITUTE, LLC",5930 SW ARCHER RD.,SUITE 700,GAINESVILLE,32608,3526822474,
ALACHUA,1594,SMALL WORLD DAYCARE & LEARNING CENTER,SMALL WORLD DAYCARE & LEARNING CENTER,1214 NW 4TH STREET,,GAINESVILLE,326014228,3523760917,
ALACHUA,4249,THE KIDZ HOUSE,THE KIDZ HOUSE,4232 NW 6TH ST.,,GAINESVILLE,326064148,3528728621,
ALACHUA,5166,THE OAK TREE CHRISTIAN ACADEMY (NORTH),THE OAK TREE CHRISTIAN ACADEMY (NORTH),1414 NE 23 AVE,,GAINESVILLE,326093869,3523719936,
ALACHUA,4535,THE OAK TREE CHRISTIAN ACADEMY (SOUTH),THE OAK TREE CHRISTIAN ACADEMY (SOUTH),1023 SE 4TH AVE,,GAINESVILLE,326016908,3523363200,
ALACHUA,1882,"CHILDHOOD DEVELOPMENT SERVICES, INC",YES I CAN KIDS ACADEMY INC,1734 SE HAWTHORNE RD,,GAINESVILLE,32641,3523715554,
BAKER,2815,ABC CHILDCARE AND LEARNING CENTER LLC,"ABC CHILDCARE & LEARNING CENTER, LLC.",627 S. 5TH ST.,,MACCLENNY,320632603,9042593455,
BAKER,583,"EPISCOPAL CHILDREN'S SERVICES, INC.",ECS BAKER HEAD START AND EARLY HEAD START,402 S 8TH STREET,,MACCLENNY,32063,9042591177,
BAKER,6742,F.L.Y. LEARNING CENTER LLC,F.L.Y. LEARNING CENTER LLC,14061 FRIENDSHIP PLACE,,SANDERSON,320872489,9042740072,
BAKER,6557,KID CITY USA GLEN ST MARY,KID CITY USA GLEN ST MARY,10274 N SHERMAN AVENUE,,GLEN ST. MARY,320405090,9042594899,
BAKER,6400,KID CITY USA MACCLENNY,KID CITY USA MACCLENNY,5418 COUNTY RD 23B,,MACCLENNY,320634145,9042595438,
BAKER,1882,"CHILDHOOD DEVELOPMENT SERVICES, INC",MRS. VANESSA LEARNING LODGE INC.,9730 S GLEN AVE,,GLEN ST. MARY,32040,9042590478,
BAKER,1882,"CHILDHOOD DEVELOPMENT SERVICES, INC",MRS. VANESSA'S LEARNING BLOCKS,522 S 7TH STREET,,MACCLENNY,32063,9042590495,
BAKER,3563,TINY TOTS DAY CARE CENTER,TINY TOTS DAY CARE CENTER,219 E. MICHIGAN AVE,,MACCLENNY,320632432,9042594737,
BAY,6294,850 KIDS,850 KIDS,1416 W 16TH ST,,PANAMA CITY,324053756,8502155437,
BAY,521,"EARLY EDUCATION AND CARE, INC.",A.D. HARRIS HEAD START ACADEMY,819 E 11TH ST,,PANAMA CITY,32401,8508189003,1103
BAY,5203,ADVENTURE CLUB LEARNING CENTER,ADVENTURE CLUB LEARNING CENTER,2405 E. BALDWIN ROAD,,PANAMA CITY,324055803,8505220171,
BAY,6213,ALL STAR LEARNING ACADEMY INC,ALL STAR LEARNING ACADEMY INC,2516 W. 23RD STREET,,PANAMA CITY,324052361,8508056500,
BAY,521,"EARLY EDUCATION AND CARE, INC.","ARNOLD/EARLY EDUCATION & CARE, INC. HEAD START",550 ALF COLEMAN ROAD,,PANAMA CITY BEACH,32407,8502363070,2408
BAY,3199,BEACH KIDS ACADEMY,BEACH KIDS ACADEMY,2016 ALLISON AVE.,,PANAMA CITY BEACH,324084800,8502306271,
BAY,521,"EARLY EDUCATION AND CARE, INC.",CHAPMAN EARLY EDUCATION CENTER,2928 EAST 11TH STREET,,PANAMA CITY,32401,8508189003,
BAY,978,CHILDCARE NETWORK,CHILDCARE NETWORK #115,5705 HICKORY STREET,,PANAMA CITY,32404,8508729032,
BAY,978,CHILDCARE NETWORK,CHILDCARE NETWORK #148,916 W. 26TH ST.,,LYNN HAVEN,32444,8502652763,
BAY,5610,CHILDWORLD LEARNING CENTER,CHILDWORLD LEARNING CENTER,3430 W. HWY 390,,PANAMA CITY,324052721,8507857322,
BAY,6736,CREATIVE KIDS ACADEMY OF CALLAWAY,CREATIVE KIDS ACADEMY OF CALLAWAY,117 A N HIGHWAY 22 A,,PANAMA CITY,324016276,8502495232,
BAY,5917,"CREATIVE KIDS ACADEMY, INC.","CREATIVE KIDS ACADEMY, INC.",1338 FLORIDA AVENUE,,PANAMA CITY,324012221,8502152674,
BAY,521,"EARLY EDUCATION AND CARE, INC.",EARLY EDUCATION CENTER HEAD START,1215 NORTH EAST AVENUE,,PANAMA CITY,32401,8507475404,
BAY,1610,FBC BAYOU GEORGE CHILDCARE CENTER,FBC BAYOU GEORGE CHILDCARE CENTER,6227 HWY 2301,,PANAMA CITY,324044424,8507637541,
BAY,2808,"FIRST STEP CHILD DEVELOPMENT CENTER, LLC",FIRST STEP CHILD DEVELOPMENT CENTER LLC,105 W. 11TH ST.,,LYNN HAVEN,324442501,8502656904,
BAY,521,"EARLY EDUCATION AND CARE, INC.",FOREST PARK HEAD START ACADEMY,700 WEST 23RD STREET SUITE H,,PANAMA CITY,32405,8508189003,1003
BAY,5584,HARVEST CHRISTIAN ACADEMY,HARVEST CHRISTIAN ACADEMY,3238 E. HWY 390,,PANAMA CITY,324056501,8502719647,
BAY,6625,KID CITY USA PANAMA CITY BEACH,KID CITY USA PANAMA CITY BEACH,7221 PATRONIS DR,,PANAMA CITY,324085744,8502333884,
BAY,1928,"LYNN HAVEN EARLY LEARNING, INC.","LYNN HAVEN EARLY LEARNING, INC.",1849 VIRGINIA AVENUE,,LYNN HAVEN,324444247,8502656221,
BAY,4508,NSA PC CHILD AND YOUTH PROGRAMS,NSA PC CHILD AND YOUTH PROGRAMS,313 SOLOMANS DR.,BLDGS. T-2036 & 632,PANAMA CITY BEACH,324077018,8502344938,
BAY,521,"EARLY EDUCATION AND CARE, INC.",PANA VILLA EARLY HEAD START CENTER,1801 1/2 FLOWERS AVE,,PANAMA CITY,32405,8504811364,
BAY,3304,PONS CHILD CARE AND DEVELOPMENT CTR,PONS CHILD CARE AND DEVELOPMENT CENTER,2626 JENKS AVE.,,PANAMA CITY,324054311,8507857344,
BAY,2713,"PRECIOUS MEMORIES CHILDCARE, INC. 2","PRECIOUS MEMORIES CHILDCARE, INC.2",12112 HWY 231,,YOUNGSTOWN,324662568,8507533285,
BAY,5817,"PRESCHOOL PLAYHOUSE OF NWFL, INC.","PRESCHOOL PLAYHOUSE OF NWFL, INC.",2543 JOHNSON DRIVE,,LYNN HAVEN,324444723,8505715441,
BAY,4201,SHARI'S CHILDREN ACADEMY,SHARI'S CHILDREN ACADEMY,1516 E 11TH ST,,PANAMA CITY,324014120,8502155968,
BAY,3902,SMALL TOWN CHILDCARE & PRESCHOOL,SMALL TOWN CHILDCARE & PRESCHOOL,7713 HIGHWAY 77,,SOUTHPORT,324091579,8502651070,
BAY,6743,STACEY'S FUN IN THE SUN 3 PRE-SCHOOL INC,STACEY'S FUN IN THE SUN 3 PRE-SCHOOL,6109 CHERRY STREET,,PANAMA CITY,324047958,8508719915,
BAY,6743,STACEY'S FUN IN THE SUN 3 PRE-SCHOOL INC,STACEY'S FUN IN THE SUN 4 PRESCHOOL INC,1139 EVERITT AVE,,PANAMA CITY,324015027,8502575320,
BAY,5552,STACEY'S FUN IN THE SUN PRESCHOOL,STACEY'S FUN IN THE SUN PRESCHOOL 2,7101 BIG DADDY DRIVE,,PANAMA CITY BEACH,32407,8502340210,
BAY,5552,STACEY'S FUN IN THE SUN PRESCHOOL,"STACEY'S FUN IN THE SUN PRESCHOOL, INC.",8713 FRONT BEACH RD.,,PANAMA CITY BEACH,32407,8502361297,
BAY,3423,"STACEY'S SWINGERS PRESCHOOL, INC.","STACEY'S SWINGERS PRESCHOOL, INC.",14130 N. HWY 77,,SOUTHPORT,324092686,8502711248,
BAY,3761,THE ACADEMY OF EARLY LEARNING,THE ACADEMY OF EARLY LEARNING,2732 E 17TH ST,,PANAMA CITY,324057208,8507403194,
BAY,829,TYNDALL CHILD DEVELOPMENT CENTER,TYNDALL AFB CHILD CARE CENTER,BLDG. 510 MISSISSIPPI RD.,,TYNDALL AFB,32403,8502834747,
BAY,829,TYNDALL CHILD DEVELOPMENT CENTER,"TYNDALL AFB, YOUTH CENTER",BLDG. 3223 SABRE DRIVE,,TYNDALL AFB,32403,8502834366,
BRADFORD,583,"EPISCOPAL CHILDREN'S SERVICES, INC.",ECS STARKE HEAD START/EARLY HEAD START`,1080 PINE STREET,,STARKE,32091,9049648280,
BRADFORD,4438,LOVE'N & LEARNING 2,LOVE'N & LEARNING 2,10228 N DIVISION ST,,HAMPTON,320440158,3524681008,
BRADFORD,6203,LOVE'N LEARNING 3,LOVE'N & LEARNING 3,202 WEST MARKET RD,,STARKE,320911519,9049642558,
BRADFORD,1322,LOVE'N & LEARNING CHILDCARE CENTER,LOVE'N & LEARNING CHILD CARE CENTER,17484 HARRELL ST.,,BROOKER,326223302,3524851550,
BRADFORD,6422,MARGATE CHRISTIAN ACADEMY,MARGATE CHRISTIAN ACADEMY,4850 W ATLANTIC BLVD,,MARGATE,330635354,9545976029,
BRADFORD,6256,MIDWAY LEARNING CENTER GROUP LLC,MIDWAY LEARNING CENTER GROUP LLC,8682 STATE ROAD 21,,MELROSE,326668962,3524752132,
BREVARD,5038,A GOLD STAR ACADEMY INC,A GOLD STAR ACADEMY INC,1330 KNOX MCRAE DR.,,TITUSVILLE,327806139,3212677740,
BREVARD,1882,"CHILDHOOD DEVELOPMENT SERVICES, INC",AMAZING FOOTPRINTS CHILD CARE CENTER,121 DEAUVILLE AVENUE SE,,PALM BAY,32909,3216767600,
BREVARD,6545,ANGEL KIDS ACADEMY OF BREVARD INC,ANGEL KIDS ACADEMY OF BREVARD INC,2930 W EAU GALLIE BLVD,,MELBOURNE,329358931,3217525555,
BREVARD,3678,APOLLO PRESCHOOL,APOLLO PRESCHOOL,155 N BABCOCK ST,,MELBOURNE,329356714,3217521161,
BREVARD,2387,"BEAR HUGS COGSWELL, INC.",BEAR HUGS COGSWELL INC,"1535 COGSWELL ST., SUITE B13",,ROCKLEDGE,329554302,3216338111,
BREVARD,6496,BELL OAK ACADEMY,BELL OAK ACADEMY,7215 WAELTI DRIVE,,MELBOURNE,329407513,3212599019,
BREVARD,3188,"BERRI PATCH III, INC","BERRI PATCH III, INC.",705 MALABAR RD,,MALABAR,329503155,3219528900,
BREVARD,3103,BERRI PATCH,BERRI PATCH INC,1320 LAKE WASHINGTON RD.,,MELBOURNE,32935,3212593222,
BREVARD,2677,"CHILD CARE OF SOUTHWEST FL., INC.",BRIGHT HORIZONS ACADEMY,550 E FLORIDA AVE,,MELBOURNE,329018305,3213121663,
BREVARD,6516,BRIGHTER DAYS PPEC,BRIGHTER DAYS PPEC,4241 N US HIGHWAY 1,,MELBOURNE,329354822,3216108718,
BREVARD,6463,BRILLIANT CREATIONS CHILDCARE CENTER LLC,BRILLIANT CREATIONS CHILDCARE CENTER LLC,285 N LAKE VIEW BLVD,,COCOA,329264176,3218064601,
BREVARD,6369,BRITT CHILDREN'S ACADEMY,BRITT CHILDREN'S ACADEMY,1108 PEACHTREE STREET,,COCOA,329228639,3216384009,
BREVARD,4279,SCHOOL BOARD OF BREVARD COUNTY,CAMBRIDGE ELEMENTARY MAGNET,2000 CAMBRIDGE DR,,COCOA,32922,3216333550,
BREVARD,4279,SCHOOL BOARD OF BREVARD COUNTY,COQUINA ELEMENTARY,850 KNOX MCRAE DR,,TITUSVILLE,32780,3212643060,
BREVARD,2612,CORAL REEF ACADEMY,CORAL REEF ACADEMY,4945 STACK BLVD,,MELBOURNE,329018502,3217268895,
BREVARD,5232,CORAL REEF ACADEMY,CORAL REEF ACADEMY,1755 WEST NASA BLVD,,MELBOURNE,329012611,3218373330,
BREVARD,4537,CROSS BRIDGE LEARNING CENTER,CROSS BRIDGE LEARNING CENTER,651 BARNES BLVD,,ROCKLEDGE,329555211,3216364603,
BREVARD,4279,SCHOOL BOARD OF BREVARD COUNTY,DISCOVERY ELEMENTARY SCHOOL,1275 GLENDALE AVE NW,,PALM BAY,32907,3219514920,
BREVARD,2985,DOORWAY TO LEARNING ENRICHMENT CENTER,DOORWAY TO LEARNING ENRICHMENT,1070 EMERSON DR. N.E.,,PALM BAY,329075542,3217251166,
BREVARD,4279,SCHOOL BOARD OF BREVARD COUNTY,ENDEAVOUR ELEMENTARY SCHOOL,905 PINEDA STREET,,COCOA,32922,3216333545,
BREVARD,4279,SCHOOL BOARD OF BREVARD COUNTY,ENTERPRISE ELEMENTARY,7000 ENTERPRISE ROAD,,PORT ST. JOHN,32927,3216333434,
BREVARD,6072,EXPLORE AND DISCOVER MELBOURNE INC,EXPLORE AND DISCOVER MELBOURNE INC,3100 AURORA RD,,MELBOURNE,329348135,3212598445,
BREVARD,5596,"EXPLORE AND DISCOVER, INC.","EXPLORE AND DISCOVER, INC.",1680 KNOX MCRAE DRIVE,,TITUSVILLE,327805411,3212693600,
BREVARD,2677,"CHILD CARE OF SOUTHWEST FL., INC.",FIRST STEPS EDUCATION LLC,675 S COURTENAY PKWY,,MERRITT ISLAND,32952,3214491199,
BREVARD,4217,GIGGLES PRESCHOOL & DAYCARE,GIGGLES PRESCHOOL & DAYCARE INC,1320 CULVER DR NE STE 10,,PALM BAY,329071104,3217236986,
BREVARD,5656,GINGERBREAD MANOR CHILD CARE CENTER,GINGERBREAD MANOR CHILD CARE CENTER,985 EYSTER BOULEVARD,,ROCKLEDGE,329553527,3216359292,
BREVARD,1220,JACK & JILL'S PLAYSCHOOL & NURSERY,JACK & JILL'S PLAYSCHOOL AND NURSERY INC.,305 ACORN DRIVE,,TITUSVILLE,327806551,3213831956,
BREVARD,6190,JELLY BEAN JUNCTION,JELLY BEAN JUNCTION,3115 NEW YORK AVE,,MELBOURNE,329347354,3212422011,
BREVARD,2677,"CHILD CARE OF SOUTHWEST FL., INC.",JUNIOR BEARS CHILD CARE LLC,2980 PAT MCKEE PLACE,,MELBOURNE,32940,3217524847,
BREVARD,4279,SCHOOL BOARD OF BREVARD COUNTY,JUPITER ELEMENTARY,950 TUPELO RD SW,,PALM BAY,32908,3219525990,
BREVARD,5724,JUST FOR KIDS,JUST FOR KIDS,1149 LAKE DR.,,COCOA,329228644,3216316252,
BREVARD,6100,JUST FOR KIDS EAST,JUST FOR KIDS EAST,365 EAST DRIVE,,MELBOURNE,329041030,3219143205,
BREVARD,6624,JUST FOR KIDS PALM BAY,JUST FOR KIDS PALM BAY,1430 GLENHAM DR NE,,PALM BAY,329054224,3218024009,
BREVARD,6548,JUST FOR KIDS TITUSVILLE,JUST FOR KIDS TITUSVILLE,1027 S PARK AVENUE,,TITUSVILLE,327803982,8633819676,
BREVARD,6562,KID CITY USA - PALM BAY,KID CITY USA - PALM BAY,1516 NORMAN ST NE,,PALM BAY,329072504,3217285503,
BREVARD,6412,KID CITY USA  MELBOURNE,KID CITY USA MELBOURNE,4950 DAIRY RD,,MELBOURNE,329048413,3219518880,
BREVARD,4994,KIDS WORLD ACADEMY OF FLORIDA,KIDS WORLD ACADEMY OF FLORIDA,1181 SAN FILIPPO DR. SE,,PALM BAY,329095793,3219140894,
BREVARD,277,KINDERCARE LEARNING CENTERS LLC,KINDERCARE LEARNING CENTER - CATALINA # 1020,55 CATALINA ISLE DRIVE,,MERRITT ISLAND,32953,3214533473,
BREVARD,277,KINDERCARE LEARNING CENTERS LLC,KINDERCARE LEARNING CENTER BARNA #793,2701 BARNA AVE,,TITUSVILLE,32780,3212683891,
BREVARD,277,KINDERCARE LEARNING CENTERS LLC,KINDERCARE LEARNING CENTER WICKHAM #792,2220 N WICKHAM ROAD,,MELBOURNE,32935,3212544029,
BREVARD,51,COM. COORD. CARE FOR CHILD. (4C),KINGDOM BUILDERS CHILDCARE CENTER INC,3155 SOUTH STREET,,TITUSVILLE,32780,3215672507,
BREVARD,1211,KOALA T KARE LEARNING CENTER,KOALA T KARE LEARNING CENTER,5319 YARBER AVENUE,,COCOA,329274807,3216365593,
BREVARD,1348,LA PETITE ACADEMY,LA PETITE ACADEMY (FRANKLIN),2111 FRANKLIN DR N.E.,,PALM BAY,32905,3216765052,
BREVARD,1348,LA PETITE ACADEMY,LA PETITE ACADEMY COURTENAY,2200 N COURTENAY PKWY,,MERRITT ISLAND,32953,3214591825,
BREVARD,1348,LA PETITE ACADEMY,LAPETITE ACADEMY (BARTON BLVD),170 BARTON BLVD,,ROCKLEDGE,32955,3216315017,
BREVARD,4117,LITTLE ANGELS CHRISTIAN BASED ACADEMY LLC,LITTLE ANGELS CHRISTIAN BASED ACADEMY LLC,3080 JUPITER BLVD SE,,PALM BAY,329094017,3219143991,
BREVARD,2677,"CHILD CARE OF SOUTHWEST FL., INC.",M AND M COMMUNITY ACADEMY INC.,807 PEACHTREE ST,,COCOA,32922,3213387690,
BREVARD,5055,CHILDREN'S HOME SOCIETY OF FLORIDA,MARJORIE OLSEN EARLY HEAD START,1403 DIXON BLVD,,COCOA,32922,3218771102,
BREVARD,4279,SCHOOL BOARD OF BREVARD COUNTY,MIMS ELEMENTARY,2582 US 1,,MIMS,32754,3212643020,
BREVARD,51,COM. COORD. CARE FOR CHILD. (4C),MUNCHKINLAND CHILD CARE CENTER,3930 FAY BLVD,,COCOA,32927,3216393700,
BREVARD,5867,MUSTARD SEED KIDZ,MUSTARD SEED KIDZ,2975 EBER BOULEVARD,,WEST MELBOURNE,329048847,3217331733,
BREVARD,6239,NEW BEGINNINGS CHILD CARE CENTER LLC,NEW BEGINNINGS CHILD CARE CENTER LLC,541 PEACHTREE STREET,,COCOA,329227238,3213387500,
BREVARD,6093,NEW DESTINY ACADEMY,NEW DESTINY ACADEMY,385 SOUTH BURNETT ROAD,,COCOA,329264075,3218770822,
BREVARD,5711,"NEW DISCOVERIES LEARNING CENTER, LLC","NEW DISCOVERIES LEARNING CENTER, LLC",332 TANGERINE AVE.,,MERRITT ISLAND,329534767,3214527300,
BREVARD,6033,MONTESSORI VILLAGE GREEN,"ODYSSEY CHARTER SCHOOL INC., DBA MONTESSORI VILLAGE GREEN",1755  ELDRON BOULEVARD SE,,PALM BAY,329096832,3217330442,113
BREVARD,6053,PALM BAY DAYCARE LLC,PALM BAY DAYCARE LLC,3585 JUPITER BLVD SE,,PALM BAY,329093856,3218024900,
BREVARD,4279,SCHOOL BOARD OF BREVARD COUNTY,PALM BAY ELEMENTARY SCHOOL,1200 ALAMANDA RD NE,,PALM BAY,32905,3217231055,
BREVARD,6247,PATCH LEARNING CENTER,PATCH LEARNING CENTER,1275 N SINGLETON AVE,,TITUSVILLE,327961968,3212683107,
BREVARD,8,PATRICK CDC,PATRICK AFB CHILD DEVELOPMENT CENTER,"1030 SCHOOL AVE., BLDG 1000",45TH FSS/FSYC - CHILD DEV. CENTER,PATRICK AFB,32925,3214947028,
BREVARD,8,PATRICK CDC,PATRICK AFB YOUTH CENTER,815 HARRIER AVE,,SATELLITE BEACH,32937,3214943007,
BREVARD,4428,PLANETKID,PLANETKID,3600 N WICKHAM RD,SUITE 103,MELBOURNE,329352374,3212597529,
BREVARD,3686,PLAYSMART LEARNING CENTER,PLAYSMART LEARNING CENTER LLC,111 TANGO AVENUE NE,,PALM BAY,329072567,3217337529,
BREVARD,4279,SCHOOL BOARD OF BREVARD COUNTY,PORT MALABAR ELEMENTARY SCHOOL,301 PIONEER AVE NE,,PALM BAY,32907,3217250070,
BREVARD,1882,"CHILDHOOD DEVELOPMENT SERVICES, INC","PRECIOUS COLLECTIONS, LLC",4000 RIO MAR DR,,ROCKLEDGE,32955,3215044100,
BREVARD,1882,"CHILDHOOD DEVELOPMENT SERVICES, INC",PRECIOUS LAMB AC INC,2162 JULIAN AVENUE NE,,PALM BAY,32905,3217268562,
BREVARD,4279,SCHOOL BOARD OF BREVARD COUNTY,SATURN ELEMENTARY,880 RANGE RD,,COCOA,32926,3216333535,
BREVARD,4279,SCHOOL BOARD OF BREVARD COUNTY,SHERWOOD ELEMENTARY,2541 POST RD,,MELBOURNE,32935,3212546424,
BREVARD,3985,SHINING STARS LEARNING CENTER,SHINING STARS LEARNING CENTER,835 SYCAMORE ST.,,TITUSVILLE,327807700,3216076881,
BREVARD,4065,SPACE COAST STEP BY STEP EARLY LEARNING CENTER,SPACE COAST STEP BY STEP EARLY LEARNING CENTER LLC,1923 KNOX MCRAE DRIVE,,TITUSVILLE,327805360,3212697455,
BREVARD,2677,"CHILD CARE OF SOUTHWEST FL., INC.",STEPS TO A BRIGHTER PATH ACADEMY LLC,1640 MINNIE ST,,COCOA,32926,3215074912,
BREVARD,4323,"THE LEARNING FACTORY ACADEMY & PRESCHOOL, LLC","THE LEARNING FACTORY ACADEMY & PRESCHOOL, LLC",2802 LIPSCOMB ST,,MELBOURNE,329017167,3215417165,
BREVARD,5508,THE LEARNING TREE ACADEMY OF PALM BAY INC,THE LEARNING TREE ACADEMY OF PALM BAY INC.,207 EMERSON DR. NW,,PALM BAY,329077891,3219513868,
BREVARD,5463,THE MELBOURNE PRESCHOOL,THE MELBOURNE PRESCHOOL,1308 SARNO RD,,MELBOURNE,329355206,3212557888,
BREVARD,6352,TICK TOCK KIDS ACADEMY LLC,TICK TOCK KIDS ACADEMY LLC,265 CROCKETT BLVD #269,,MERRITT ISLAND,329532621,3212087094,
BREVARD,5055,CHILDREN'S HOME SOCIETY OF FLORIDA,U.F. GIBBS EARLY HEAD START,7835 BABCOCK ST SE,,PALM BAY,329095906,3213275128,
BREVARD,4279,SCHOOL BOARD OF BREVARD COUNTY,UNIVERSITY PARK ELEMENTARY,500 W UNIVERSITY BLVD,,MELBOURNE,32901,3217232566,
BREVARD,6273,VIZION CHRISTIAN ACADEMY LEARNING CENTER,VIZION CHRISTIAN ACADEMY LEARNING CENTER,1101 WOODLAKE DR NE,,PALM BAY,329053274,3216764364,
BREVARD,4237,WISH UPON A STAR PRESCHOOL & DAYCARE INC,WISH UPON A STAR PRESCHOOL & DAYCARE INC,5305 BABCOCK ST NE,,PALM BAY,329055015,3217261580,
BREVARD,5055,CHILDREN'S HOME SOCIETY OF FLORIDA,ZIGLER CHILD DEVELOPMENT CENTER,1430 KNECHT RD NE,,PALM BAY,32905,3213277552,
BROWARD,6659,A CHANGE IN THE GAME INC,A CHANGE IN THE GAME INC,6150 PEMBROKE RD,,MIRAMAR,330232214,9549014492,
BROWARD,1976,"FAMILY CENTRAL, INC.",A FAMILY CHILD CARE,4000 SW 19 ST,,FT. LAUDERDALE,33317,9545832500,
BROWARD,1976,"FAMILY CENTRAL, INC.",A KIDS WORLD ACADEMY,3750 NE 3RD AVE,,DEERFIELD BEACH,33064,9549464190,
BROWARD,2905,"A.B.C DAY CARE AND LEARNING CENTER, INC.","A.B.C DAY CARE & LEARNING CENTER, INC.",9091 TAFT ST,,PEMBROKE PINES,330244650,9544042231,
BROWARD,6748,AA ACADEMY LEARNING CENTER 3 LLC,AA ACADEMY LEARNING CENTER 3 LLC,6300 POLK ST,,HOLLYWOOD,330247730,9548947711,
BROWARD,5927,AA ACADEMY LEARNING CENTER LLC,AA ACADEMY LEARNING CENTER LLC,920 S STATE RD 7,,PLANTATION,333174523,9543216006,
BROWARD,1976,"FAMILY CENTRAL, INC.",ABC LEARNING CENTER OF CORAL SPRINGS,10623 W ATLANTIC BLVD,,CORAL SPRINGS,33071,9543445104,
BROWARD,5124,ABC LEARNING PREP,ABC LEARNING PREP,18239 PINES BOULEVARD,,PEMBROKE PINES,330291418,9544411260,
BROWARD,1976,"FAMILY CENTRAL, INC.",ABC WORKSHOP OF LIGHTHOUSE POINT,3850 N FEDERAL HWY,,LIGHTHOUSE POINT,33064,9549463300,
BROWARD,5639,"ABCS OF LEARNING AND GROWING, INC.","ABCS OF LEARNING AND GROWING, INC.",7720 KIMBERLY BLVD.,,NORTH LAUDERDALE,330683226,9547227082,
BROWARD,1798,"HIGHLAND FOOD RESOURCES, INC.",ACHIEVERS ACADEMY,10777 PEMBROKE ROAD,,PEMBROKE PINES,33025,9544479962,
BROWARD,1798,"HIGHLAND FOOD RESOURCES, INC.",ACHIEVERS' PRESCHOOL LLC,2901 W OAKLAND PARK BLVD.  A10-13,,OAKLAND PARK,33311,9547318676,
BROWARD,4588,ADHERE ACADEMY,ADHERE ACADEMY,905 SW 8TH AVENUE,,HALLANDALE BEACH,330096807,9544584660,
BROWARD,1976,"FAMILY CENTRAL, INC.",ADVANCED ACHIEVERS ACADEMY PRESCHOOL,245 NW 11TH STREET,,POMPANO BEACH,33060,7543071525,
BROWARD,1976,"FAMILY CENTRAL, INC.",AGES AND STAGES LEARNING CENTER,2231 NW 5TH STREET,,POMPANO BEACH,33069,9547077976,
BROWARD,1976,"FAMILY CENTRAL, INC.",ALL MY CHILDREN ACADEMY,2061 N DIXIE HIGHWAY,,POMPANO BEACH,33060,9547836774,
BROWARD,1976,"FAMILY CENTRAL, INC.",ALL MY CHILDREN ACADEMY IV,355 NW 3 COURT,,DEERFIELD BEACH,33441,9544219006,
BROWARD,1976,"FAMILY CENTRAL, INC.",ALL SAINTS LUTHERAN PRESCHOOL,7875 W MCNAB RD,,TAMARAC,33321,9547261973,
BROWARD,6114,AMAZING ACHIEVERS ACADEMY,AMAZING ACHIEVERS ACADEMY,6247 COUNTY LINE ROAD,,MIRAMAR,330235028,9545442561,
BROWARD,1976,"FAMILY CENTRAL, INC.",AMBERWOOD ACADEMY,4939 N. UNIVERSITY DRIVE,,LAUDERHILL,33351,9547474774,
BROWARD,1976,"FAMILY CENTRAL, INC.",AMERICAN EAGLE ACADEMY,10046 W MCNAB RD,,TAMARAC,33321,9547227102,
BROWARD,1976,"FAMILY CENTRAL, INC.",AMERICAN EAGLE ACADEMY II - N LAUDERDALE CAMPUS,3601 W COMMERCIAL BLVD SUITE 39,,NORTH LAUDERDALE,33309,9545355660,
BROWARD,1976,"FAMILY CENTRAL, INC.",APPLE OF MY EYE CHILD CARE LEARNING CENTER,2500 NW 14TH STREET BLDG B,,FT. LAUDERDALE,33311,9545819992,
BROWARD,1798,"HIGHLAND FOOD RESOURCES, INC.",APPLESEEDS PERFORMING ARTS ACADEMY,4537 WEST BROWARD BOULEVARD,,PLANTATION,33317,9546521035,
BROWARD,1976,"FAMILY CENTRAL, INC.",ATLANTIC PRIVATE PRESCHOOL,8303 W ATLANTIC BLVD SUITE 1,,CORAL SPRINGS,33071,9548250338,
BROWARD,1976,"FAMILY CENTRAL, INC.",BABYVILLE PRESCHOOL LEARNING CENTER II,3140 NORTHWEST 21ST AVE,,OAKLAND PARK,33309,9548078336,
BROWARD,4437,BEE CREATIVE ACADEMY,BEE CREATIVE ACADEMY,4009 W HALLANDALE BEACH BLVD,,WEST PARK,330234447,7544007655,
BROWARD,1976,"FAMILY CENTRAL, INC.","BENJAMIN ACADEMY, INC.",5812 TAFT ST,,HOLLYWOOD,33021,9549812222,
BROWARD,1976,"FAMILY CENTRAL, INC.",BETHEL CHRISTIAN ACADEMY,6060 KIMBERLY BLVD,,NORTH LAUDERDALE,33068,9549723321,
BROWARD,6246,BIG BEAR ACADEMY BROWARD INC,BIG BEAR ACADEMY BROWARD INC,4701 S STATE RD 7,,DAVIE,333144647,9544871663,
BROWARD,1976,"FAMILY CENTRAL, INC.",BLOOMING MINDS ACADEMY,1150 S POWERLINE RD,,POMPANO BEACH,33069,9548761583,
BROWARD,1976,"FAMILY CENTRAL, INC.","BOATWRIGHT FAMILY DAY CARE CENTER, INC.",1431 N.W. 31 AVE.,,FT. LAUDERDALE,33311,9547354966,
BROWARD,6278,BRIGHT ANGELS ACADEMY PRESCHOOL,BRIGHT ANGELS ACADEMY PRESCHOOL,4007 SW 19 ST,,WEST PARK,330233409,7862735097,
BROWARD,1976,"FAMILY CENTRAL, INC.",BRIGHT BEGINNINGS PRESCHOOL & AFTERSCHOOL,2500 NE 14 STREET CAUSEWAY,,POMPANO BEACH,33062,9547861007,
BROWARD,1976,"FAMILY CENTRAL, INC.",BRIGHT FUTURE LEARNING CENTER OF CORAL SPRINGS,3811 CORAL SPRINGS DRIVE,,CORAL SPRINGS,33065,9547521840,
BROWARD,1976,"FAMILY CENTRAL, INC.",BRIGHT KIDS BILINGUAL PRESCHOOL,3801 N UNIVERSITY DRIVE,,SUNRISE,33351,9544403512,
BROWARD,2667,BRIGHTON ACADEMY II,BRIGHTON ACADEMY II,560 E. MCNAB RD.,,POMPANO BEACH,330609324,9547821234,
BROWARD,4424,BRIGHTSTAR LEARNING CENTER,BRIGHTSTAR LEARNING CENTER,6200 NW 11TH ST,,SUNRISE,333136118,9543162188,
BROWARD,1976,"FAMILY CENTRAL, INC.",BRIGHTSTAR PRESCHOOL,4340 WEST OAKLAND PARK BOULEVARD,,LAUDERDALE LAKES,33311,9547303360,
