ORANGE,4222,SUPERKIDS ACADEMY LAKE NONA,SUPERKIDS ACADEMY OF LAKE NONA,10743 NARCOOSSEE RD,,ORLANDO,328326944,4076747966,
ORANGE,4166,SUPERSTAR'S ACADEMY LEARNING CENTER,SUPERSTAR'S ACADEMY LEARNING CENTER,422 S. PARRAMORE AVE.,,ORLANDO,328052373,3212475707,
ORANGE,51,COM. COORD. CARE FOR CHILD. (4C),SUPREME CHILD CARE AND DEV. CENTER,5745 EDGEWATER DR,,ORLANDO,32810,4072930022,
ORANGE,51,COM. COORD. CARE FOR CHILD. (4C),SWEET DREAMS CHILD CARE INC,7230 W COLONIAL DR,,ORLANDO,32818,4072539056,
ORANGE,734,ORANGE COUNTY HEAD START DIVISION,TAFT HEAD START CENTER,9504 S ORANGE AVE,,ORLANDO,32824,4072549274,
ORANGE,6105,TATTLE TALES LEARNING CENTER,TATTLE TALES LEARNING CENTER,1211 N PINE HILLS RD,,ORLANDO,328086228,4078443465,
ORANGE,51,COM. COORD. CARE FOR CHILD. (4C),THE CONRAD ACADEMY & PRESCHOOL,2008 N GOLDENROD RD,,ORLANDO,32807,4072432211,
ORANGE,51,COM. COORD. CARE FOR CHILD. (4C),THE FRIENDS ACADEMY,53 S DEAN RD,,ORLANDO,32825,4072820039,
ORANGE,51,COM. COORD. CARE FOR CHILD. (4C),THE GROWING ME LEARNING CENTER,304 EAST OAKLAND AVE,,OAKLAND,34760,4075904440,
ORANGE,3868,THE KING'S ACADEMY,THE KING'S ACADEMY,1302 EDGEWAY DR,,WINTER GARDEN,347872927,4076565665,0
ORANGE,6709,THE LEARNING EXPERIENCE AT APOPKA,THE LEARNING EXPERIENCE,2295 EAST SEMORAN BOULEVARD,,APOPKA,327035713,4077039480,
ORANGE,6483,THE LEARNING PLACE ACADEMY,THE LEARNING PLACE ACADEMY,1616 CONWAY GARDENS RD,,ORLANDO,328063463,4078986941,
ORANGE,51,COM. COORD. CARE FOR CHILD. (4C),THE PLAY PALACE CHILD CARE LLC,2817 N POWERS DR,,ORLANDO,32818,4075227045,
ORANGE,4655,THE VILLAGE PRESCHOOL,THE VILLAGE PRESCHOOL,5413 EDGEWATER DR,,ORLANDO,328105250,4072982100,
ORANGE,734,ORANGE COUNTY HEAD START DIVISION,THREE POINTS HEAD START,4001 SOUTH GOLDENROD RD,,ORLANDO,32822,4072073800,3982288
ORANGE,51,COM. COORD. CARE FOR CHILD. (4C),TINY MIRACLES ACADEMY,1250 N PINE HILLS ROAD,,ORLANDO,32808,4077769710,
ORANGE,51,COM. COORD. CARE FOR CHILD. (4C),TINY TOTS OF APOPKA,201 S. PARK AVENUE,,APOPKA,32703,4078144811,
ORANGE,1132,TODAY'S KIDS DAY CARE CENTER,TODAY'S KIDS DAY CARE CENTER,2625 HIAWASSE ROAD,,ORLANDO,328183007,4075783870,
ORANGE,1882,"CHILDHOOD DEVELOPMENT SERVICES, INC",TOP KIDS ACADEMY INC,1912 N DEAN RD,,ORLANDO,32817,4074822120,
ORANGE,6062,TOP SPOT ACADEMY,TOP SPOT ACADEMY,1715 LAKE PICKETT RD,,ORLANDO,328264941,4076589332,
ORANGE,51,COM. COORD. CARE FOR CHILD. (4C),TOUCHED BY AN ANGEL EARLY EDUCATION INTERVENTION ACADEMY,1403 W. COLONIAL DRIVE,,ORLANDO,32804,4076746004,
ORANGE,3435,TREASURE KIDS ACADEMY,TREASURE KIDS ACADEMY,1025 S. CLARKE ROAD,,OCOEE,347616995,4075225740,
ORANGE,5352,TREASURE KIDS ACADEMY,TREASURE KIDS ACADEMY,2275 WHISPER LAKES BLVD,,ORLANDO,328375913,4078550600,
ORANGE,6739,TREE HOUSE EDUCATIONAL CENTER ORL LLC,TREE HOUSE EDUCATIONAL CENTER ORL LLC,1851 S GOLDENROD RD,,ORLANDO,328228075,4072825158,
ORANGE,5566,TRINITY CHILD DEVELOPMENT CENTER,TRINITY CHILD DEVELOPMENT CENTER,420 AND 424 RUTH LANE,,ORLANDO,328011513,4078493680,220
ORANGE,6113,TRUE COLORS LEARNING CENTER LLC,TRUE COLORS LEARNING CENTER LLC,3300 CONWAY RD,,ORLANDO,328127335,3212367004,
ORANGE,6268,UNDER THE SUN ACADEMY,UNDER THE SUN ACADEMY,8414 E COLONIAL DR,,ORLANDO,328173912,4074403334,
ORANGE,51,COM. COORD. CARE FOR CHILD. (4C),VALENTINE LEARNING CENTER LLC,216 N IVEY LANE,,ORLANDO,32811,4079523369,
ORANGE,734,ORANGE COUNTY HEAD START DIVISION,VENTURA ELEMENTARY HEAD START,4400 WOODGATE BLVD,,ORLANDO,32822,4072496400,4002283
ORANGE,734,ORANGE COUNTY HEAD START DIVISION,WASHINGTON SHORES ELC,2500 BRUTON BLVD,,ORLANDO,32805,4072506260,6352257
ORANGE,734,ORANGE COUNTY HEAD START DIVISION,WASHINGTON SHORES ELEMENTARY HEAD START,944 W LAKE MANN DRIVE,,ORLANDO,32805,4072966540,4012242
ORANGE,6627,WE ARE ONE SERVICES LLC EARLY CHILDHOOD ACADEMY,WE ARE ONE SERVICES LLC EARLY CHILDHOOD ACADEMY,1215 MERCY DR,,ORLANDO,328087365,4078228906,
ORANGE,6626,WE ARE ONE SERVICES LLC EARLY CHILDHOOD DEVELOPMENT CENTER,WE ARE ONE SERVICES LLC EARLY CHILDHOOD DEVELOPMENT CENTER,1304 N PINE HILLS ROAD,,ORLANDO,328084817,4074404914,
ORANGE,51,COM. COORD. CARE FOR CHILD. (4C),WELBOURNE AVENUE NURSERY AND KINDERGARTEN,450 W WELBOURNE AVE,,WINTER PARK,32789,4076445885,
ORANGE,51,COM. COORD. CARE FOR CHILD. (4C),WEST LAKES EARLY LEARNING CENTER,2122 LONG STREET,,ORLANDO,32805,4076093960,
ORANGE,734,ORANGE COUNTY HEAD START DIVISION,WEST OAKS HEAD START,905 DOSCHER ROAD,,ORLANDO,32818,4075323875,4052235
ORANGE,3751,WINTER PARK DAY NURSERY INC,WINTER PARK DAY NURSERY INC,741 S PENNSYLVANIA AVE,,WINTER PARK,327895049,4076470505,
ORANGE,51,COM. COORD. CARE FOR CHILD. (4C),WONDERLAND CHILDCARE CENTER,2095 DUNDEE DR,,WINTER PARK,32792,4076283774,
ORANGE,5764,YOUNG PLANET ACADEMY,YOUNG PLANET ACADEMY,5449 S. SEMORAN BLVD. #21,,ORLANDO,328221776,4076748058,
OSCEOLA,3,COM. COORD. CARE FOR CHILD. (4C),4C HEAD START PALM PLAZA,2230 E. IRLO BRONSON MEM. HWY #2236,,KISSIMMEE,34744,4077974056,
OSCEOLA,51,COM. COORD. CARE FOR CHILD. (4C),A SHINING STARS EARLY LEARNING CENTER INC,"101 W CYPRESS ST, UNIT D",,KISSIMMEE,34741,4078700646,
OSCEOLA,51,COM. COORD. CARE FOR CHILD. (4C),ALMA MATER LYCEUM LEARNING CONNECTIONS CENTER,2500 N BEAUMONT AVE,,KISSIMMEE,34741,4078700711,
OSCEOLA,51,COM. COORD. CARE FOR CHILD. (4C),AMERICAN TUTORING INSTITUTE-PRESCHOOL ATI,4178 S. ORANGE BLOSSOM TRAIL,,KISSIMMEE,34746,4076557242,
OSCEOLA,4507,AROUND THE WORLD LEARNING CENTER,AROUND THE WORLD LEARNING CENTER,2511 TRAFALGAR BLVD,,KISSIMMEE,347582551,4073504553,
OSCEOLA,51,COM. COORD. CARE FOR CHILD. (4C),BUILDING WINGS PRESCHOOL,1901 S JOHN YOUNG PKWY UNIT #113,,KISSIMMEE,34741,4073505053,
OSCEOLA,51,COM. COORD. CARE FOR CHILD. (4C),BUILDING WINGS PRESCHOOL 2,1901 S JOHN YOUNG PARKWAY STE 109,,KISSIMMEE,34741,4077505773,
OSCEOLA,6118,CENTRAL FLORIDA YMCA LEARNING CENTERS,CENTRAL FLORIDA YMCA LEARNING CENTER-SHERBERTH ROAD,3261 SHERBERTH RD,,KISSIMMEE,34747,4073963001,
OSCEOLA,51,COM. COORD. CARE FOR CHILD. (4C),CHILD CARE ACADEMY LLC,1306 DYER BLVD,,KISSIMMEE,34741,3216975099,
OSCEOLA,5994,CHILDREN'S PREP ACADEMY,CHILDREN'S PREP ACADEMY,3180 BILL BECK BLVD,,KISSIMMEE,347441608,4072015864,
OSCEOLA,5517,CHURCH ALIVE PRESCHOOL,CHURCH ALIVE PRESCHOOL,3678 OLD CANOE CREEK RD,,ST. CLOUD,347697600,4077445424,
OSCEOLA,6752,COUNTRY CUBS LEARNING CENTER,COUNTRY CUBS LEARNING CENTER,2630 MARTINA AVENUE,,KISSIMMEE,347411742,4078467555,
OSCEOLA,51,COM. COORD. CARE FOR CHILD. (4C),CREATIVE KIDS CONNECTION,8681 W IRLO BRONSON MEM HWY #122,,KISSIMMEE,34747,4074655516,
OSCEOLA,51,COM. COORD. CARE FOR CHILD. (4C),DISCOVERERS LEARNING ACADEMY,1311 BAY STREET,,KISSIMMEE,34744,4077853310,
OSCEOLA,3721,DREAMING BIG LEARNING CENTER,DREAMING BIG LEARNING CENTER,3301 W. OAK STREET,,KISSIMMEE,347413813,4079314355,
OSCEOLA,51,COM. COORD. CARE FOR CHILD. (4C),EDUKIDS ACADEMY LLC,2610 N. JOHN YOUNG PARKWAY,,KISSIMMEE,34741,4079609426,
OSCEOLA,1569,GINGERBREAD HOUSE I,GINGERBREAD HOUSE I,99 BRIDLE CT,,KISSIMMEE,347436304,4073485437,
OSCEOLA,4726,HANSEL & GRETEL PRESCHOOL,HANSEL AND GRETEL PRESCHOOL,4513 NEPTUNE RD,,ST. CLOUD,347696750,4078927727,
OSCEOLA,4720,HEART OF A CHILD LEARNING CENTER,HEART OF A CHILD LEARNING CENTER,2047 E IRLO BRONSON MEMORIAL HWY,,KISSIMMEE,34744,4073504867,
OSCEOLA,3508,HEAVENLY KIDS PRESCHOOL & CHILDCARE,HEAVENLY KIDS PRESCHOOL & CHILDCARE,711 N THACKER AVENUE,,KISSIMMEE,347414834,4078707844,207
OSCEOLA,51,COM. COORD. CARE FOR CHILD. (4C),JJ ROUSSEAU PRESCHOOL,2647 MICHIGAN AVENUE,,KISSIMMEE,34744,4072018941,
OSCEOLA,5090,KID CITY USA ST CLOUD,KID CITY USA ST CLOUD,1422 VIRGINIA AVE,,ST. CLOUD,347694519,3218054780,
OSCEOLA,5378,KID'S PALACE ACADEMY INC,KID'S PALACE ACADEMY INC,1336 EAST VINE ST,,KISSIMMEE,347443624,4079331814,
OSCEOLA,51,COM. COORD. CARE FOR CHILD. (4C),KIDDIE KIDS DAYCARE CENTER LLC,1207 VERMONT AVENUE,,ST. CLOUD,34769,4075774375,
OSCEOLA,51,COM. COORD. CARE FOR CHILD. (4C),KIDS WORLD LEARNING ACADEMY,2921 CANOE CREEK ROAD,,ST. CLOUD,34772,4075563313,
OSCEOLA,6684,KIDS WORLD PRESCHOOL KISSIMMEE INC,KIDS WORLD PRESCHOOL KISSIMMEE INC,1954 N JOHN YOUNG PKWY,,KISSIMMEE,347413221,4072014903,
OSCEOLA,3956,KIDSVILLE ACADEMY 2,KIDSVILLE ACADEMY 2,110 MICHELLE LN,,KISSIMMEE,347434068,4073448224,
OSCEOLA,4207,KIDSVILLE ACADEMY INC,KIDSVILLE ACADEMY INC,2557 REMINGTON BLVD,,KISSIMMEE,347448400,4074837000,
OSCEOLA,1348,LA PETITE ACADEMY,LA PETITE ACADEMY #151,2825 ALICE BLVD.,,KISSIMMEE,34746,4078709155,
OSCEOLA,1348,LA PETITE ACADEMY,LA PETITE ACADEMY #153,2400 MILL RUN BLVD.,,KISSIMMEE,34744,4078461598,
OSCEOLA,1348,LA PETITE ACADEMY,LA PETITE ACADEMY #154,130 BUENAVENTURA BLVD.,,KISSIMMEE,34743,4073486846,
OSCEOLA,6629,LET THE CHILDREN COME CENTER INC.,LET THE CHILDREN COME CENTER INC.,4340 W VINE STREET,,KISSIMMEE,347466313,4075070211,
OSCEOLA,5430,LIL EXPLORERS KISSIMMEE INC,LIL EXPLORERS KISSIMMEE INC,1430 SMITH ST,,KISSIMMEE,347443475,4075185048,
OSCEOLA,5668,LIL EXPLORERS ST. CLOUD,LIL EXPLORERS ST. CLOUD,1202 WISCONSIN AVE,,ST. CLOUD,347693634,4078920995,
OSCEOLA,45,"LINCOLN-MARTI COMMUNITY AGENCY, INC",LINCOLN-MARTI COMMUNITY AGENCY,2244 FORTUNE ROAD,,KISSIMMEE,34743,3056421000,
OSCEOLA,51,COM. COORD. CARE FOR CHILD. (4C),LITTLE CREATIONS ACADEMY,448 W DONEGAN AVE,,KISSIMMEE,34741,4078702510,
OSCEOLA,51,COM. COORD. CARE FOR CHILD. (4C),LITTLE STARS FAMILY LEARNING ACADEMY,2242 E IRLO BRONSON MEMORIAL HWY,,KISSIMMEE,34743,4077508000,
OSCEOLA,6332,LITTLE WARRIORS ACADEMY,LITTLE WARRIORS ACADEMY,3301 FOREST DR,,KISSIMMEE,347463905,4073503981,
OSCEOLA,6707,MY FIRST ACADEMY,MY FIRST ACADEMY,2245 FORTUNE ROAD,,KISSIMMEE,347444404,4078702263,
OSCEOLA,6740,MY FIRST ACADEMY 2,MY FIRST ACADEMY 2,3024 DYER BOULEVARD,,KISSIMMEE,347417839,4077505904,
OSCEOLA,6737,MY FIRST ACADEMY 4,MY FIRST ACADEMY 4,1013 N. NARCOOSSEE RD,,ST. CLOUD,347718777,4075931222,
OSCEOLA,5824,MY LITTLE CASTLE PRE-SCHOOL,MY LITTLE CASTLE PRE-SCHOOL,1301 KEVSTIN DR,,KISSIMMEE,347445844,4075728607,
OSCEOLA,51,COM. COORD. CARE FOR CHILD. (4C),NEW FAITH COMMUNITY CHURCH,5000 HOLOPAW ROAD,,ST. CLOUD,34773,4078921285,
OSCEOLA,51,COM. COORD. CARE FOR CHILD. (4C),OUR LITTLE FLOWER BUDS LLC,2507 TRAFALGAR BLVD,,KISSIMMEE,34758,4072723280,
OSCEOLA,4675,PARTYTIME PLAYHOUSE PRESCHOOL,PARTYTIME PLAYHOUSE PRESCHOOL,2050 OLD HICKORY TREE RD,,ST. CLOUD,347728926,4075563904,
OSCEOLA,51,COM. COORD. CARE FOR CHILD. (4C),"PHA PREPARATORY SCHOOL, INC.",140 POMPEI DRIVE,,KISSIMMEE,34758,4079441378,
OSCEOLA,51,COM. COORD. CARE FOR CHILD. (4C),PLANET LEARNING PRESCHOOL INC.,1337 E OSCEOLA PARKWAY,,KISSIMMEE,34744,4075304500,
OSCEOLA,51,COM. COORD. CARE FOR CHILD. (4C),READY SET GROW LEARNING CENTER LLC,1431 N. CENTRAL AVENUE,,KISSIMMEE,34741,4078463955,
OSCEOLA,51,COM. COORD. CARE FOR CHILD. (4C),SEEDS OF JOY CHILDCARE LLC,1318 W OAK STREET STE 2,,KISSIMMEE,34741,4077504008,
OSCEOLA,51,COM. COORD. CARE FOR CHILD. (4C),TEACHING TIME ACADEMY INC.,1072 PLAZA DRIVE,,KISSIMMEE,34743,4074082303,
OSCEOLA,3214,TELE TOTS PRIME TIME FOR KIDS LEARNING CENTER,TELE TOTS PRIME TIME FOR KIDS LEARNING CENTER,1718 E. IRLO BRONSON MEMORIAL HWY,,ST. CLOUD,347715806,4078911115,
OSCEOLA,3261,TINY TOTS CHRISTIAN ACADEMY,TINY TOTS CHRISTIAN ACADEMY,1605 MICKLER ST.,,KISSIMMEE,347413305,4079323800,
OSCEOLA,6474,TINY TOTS CHRISTIAN ACADEMY EAST,TINY TOTS CHRISTIAN ACADEMY EAST,2080 MICHIGAN AVENUE,,KISSIMMEE,347442904,4079334220,
OSCEOLA,51,COM. COORD. CARE FOR CHILD. (4C),TURTLE TOTS ACADEMY,3255 S JOHN YOUNG PARKWAY,,KISSIMMEE,34746,4073504925,
OSCEOLA,51,COM. COORD. CARE FOR CHILD. (4C),TURTLE TOTS ACADEMY II,1420 E OSCEOLA PARKWAY,,KISSIMMEE,34744,4077506872,
PALM BEACH,1976,"FAMILY CENTRAL, INC.",7 STARS ACADEMY OF PALM BEACH GARDENS,7936 N MILITARY TRAIL,,RIVIERA BEACH,33410,5618420071,
PALM BEACH,5659,A BABY'S WORLD,A BABY'S WORLD,2884 S. MILITARY TRL.,,WEST PALM BEACH,334159231,5614330081,
PALM BEACH,4965,A KID'S WORLD OF FUN AND LEARNING,A KID'S WORLD OF FUN AND LEARNING,2616 KIRK ROAD,,WEST PALM BEACH,334068548,5619670844,
PALM BEACH,1976,"FAMILY CENTRAL, INC.",A NEW BEGINNING ACADEMY,832 W CANAL STREET S,,BELLE GLADE,33430,5617675555,
PALM BEACH,1976,"FAMILY CENTRAL, INC.","A READING & MATH ACADEMY, INC",4485 S. HAVERHILL RD.,,LAKE WORTH,33463,5615435151,
PALM BEACH,1976,"FAMILY CENTRAL, INC.","A READING AND MATH ACADEMY (MILITARY TRAIL, INC)",6697 S MILITARY TRAIL,,LAKE WORTH,33463,5613188945,
PALM BEACH,1976,"FAMILY CENTRAL, INC.",A STEP ABOVE EARLY LEARNING CENTER INC,1114 SE 2ND STREET,,BOYNTON BEACH,33435,5617328126,
PALM BEACH,1976,"FAMILY CENTRAL, INC.",A+ KIDZ ACADEMY INC,4800 23RD STREET N,,WEST PALM BEACH,33417,5616841123,
PALM BEACH,3825,ABC MONTESSORI ACADEMY,ABC MONTESSORI ACADEMY,700 S ORANGE AVE,,JUPITER,334585740,5615754331,
PALM BEACH,3927,ABC PLAYSCHOOL CHILD CARE INC,ABC PLAYSCHOOL CHILDCARE INC,1165 PALM BEACH ROAD,,SOUTH BAY,334931909,5619929271,
PALM BEACH,1976,"FAMILY CENTRAL, INC.",ABOVE AND BEYOND PRESCHOOL FL LLC,672 CAMELLIA DRIVE,,ROYAL PALM BEACH,33411,5617936533,
PALM BEACH,5402,ACADEMY FOR CHILD ENRICHMENT,ACADEMY FOR CHILD ENRICHMENT,700 CAMELLIA DR,,ROYAL PALM BEACH,334117610,5617983458,
PALM BEACH,6476,ACADEMY FOR CHILD ENRICHMENT,ACADEMY FOR CHILD ENRICHMENT,14563 OKEECHOBEE BLVD,,LOXAHATCHEE GROVES,334704826,5617536624,
PALM BEACH,3528,ACADEMY OF NORTH PALM BEACH,ACADEMY OF NORTH PALM BEACH MONTESSORI,2526 RICHARD RD.,,NORTH PALM BEACH,334031426,5613139995,
PALM BEACH,652,ACHIEVEMENT CENTERS FOR CHILDREN & FAMILIES,ACHIEVEMENT CENTERS FOR CHILDREN AND FAMILIES,555 N.W. 4TH STREET,,DELRAY BEACH,334442734,5612760520,
PALM BEACH,1976,"FAMILY CENTRAL, INC.",ACREAGE MONTESSORI ACADEMY,5700 140 AVE N,,ROYAL PALM BEACH,33411,5617840078,
PALM BEACH,4622,ALL ABOUT KIDS,ALL ABOUT KIDS,5459 LANTANA RD,,LAKE WORTH,334636831,5619685081,
PALM BEACH,6208,ALL ABOUT KIDS LEARNING CENTER,ALL ABOUT KIDS LEARNING CENTER,3839 N HAVERHILL ROAD,,WEST PALM BEACH,334178306,5616880202,
PALM BEACH,3504,"ALL ABOUT LEARNING CENTER, INC.","ALL ABOUT LEARNING CENTER, INC.",604 CAMELLIA DR.,,ROYAL PALM BEACH,33411,5617935641,
PALM BEACH,5196,ATKINS TENDER LOVING CARE,ATKINS TENDER LOVING CARE,2721 RJ HENDLEY AVENUE,,RIVIERA BEACH,334044167,5612933605,
PALM BEACH,836,"ATKINS TENDER LOVING CARE, INC.","ATKINS TENDER LOVING CARE, INC. #1",1144 W. 10TH ST.,,RIVIERA BEACH,33404,5618486768,
PALM BEACH,836,"ATKINS TENDER LOVING CARE, INC.","ATKINS TENDER LOVING CARE, INC. #2",1133 W. 10TH ST.,,RIVIERA BEACH,33404,5618486753,
PALM BEACH,83,EAST COAST MIGRANT HEAD START PROJECT,BELLE GLADE EDUCATIONAL CAMPUS,2050 DUDA RD.,,BELLE GLADE,33430,5619962232,
PALM BEACH,4514,BETHLEHEM LEARNING CENTER,BETHLEHEM LEARNING CENTER,425 CRESCENT DRIVE,,LAKE PARK,334032258,5618817672,
PALM BEACH,1976,"FAMILY CENTRAL, INC.",BIG DREAMS PRESCHOOL LLC,1713 QUAIL DRIVE,,WEST PALM BEACH,33409,5613603745,
PALM BEACH,6720,BOCA RATON HOUSING AUTHORITY,BOCA RATON HOUSING AUTHORITY,1350 N DIXIE HIGHWAY,,BOCA RATON,334321849,5613942496,
PALM BEACH,4982,BOCA RATON PRESCHOOL,BOCA RATON PRESCHOOL,4800 T-REX AVE #110,,BOCA RATON,334314479,5614655431,
PALM BEACH,5226,BOYNTON BEACH PRESCHOOL,BOYNTON BEACH PRESCHOOL,"6609 WOOLBRIGHT RD., SUITE 400",6609 WOOLBRIGHT RD UNIT 406,BOYNTON BEACH,334370910,5618104520,
PALM BEACH,5164,BRAVE LITTLE STARS,BRAVE LITTLE STARS,1717 NE 2ND AVENUE,,DELRAY BEACH,334444109,5614506695,
PALM BEACH,6749,BRAVE LITTLE STARS ACADEMY,BRAVE LITTLE STARS ACADEMY,3108 SOUTH CONGRESS AVENUE,,PALM SPRINGS,334612552,5615304814,
PALM BEACH,4268,BRIGHT BEGINNINGS OF LAKE WORTH INC,BRIGHT BEGINNINGS OF LAKE WORTH INC,3456 S JOG RD,,GREENACRES,334672012,5616298005,
PALM BEACH,5644,"BRIGHT CHILD ACADEMY III, INC.","BRIGHT CHILD ACADEMY III, INC.",406 FEDERAL HWY.,,LAKE PARK,334033568,5616531258,
PALM BEACH,1976,"FAMILY CENTRAL, INC.","BRIGHT FUTURES CHILD DEVELOPMENT CENTER, INC.",910 WEST ILEX DRIVE,,LAKE PARK,33403,5618448400,
PALM BEACH,5205,"BRIGHT IDEAS EDUCATIONAL CENTER, INC.","BRIGHT IDEAS EDUCATIONAL CENTER, INC.",331 EAST MAIN STREET,,PAHOKEE,334761809,5619243199,
PALM BEACH,1976,"FAMILY CENTRAL, INC.",BUILDING DREAMS PRESCHOOL II INC,1137 SUNSET ROAD,,WEST PALM BEACH,33406,5614349800,
PALM BEACH,1976,"FAMILY CENTRAL, INC.",BUILDING DREAMS PRESCHOOL INC,2361 S BEECH RD,,WEST PALM BEACH,33409,5616878266,
PALM BEACH,1976,"FAMILY CENTRAL, INC.",BURKS LEARNING CENTER,111-115 SW 10TH AVE,,DELRAY BEACH,33444,5612789617,
PALM BEACH,5363,CHILDREN OF THE FUTURE CHRISTIAN COLLEGE INC,CHILDREN OF THE FUTURE CHRISTIAN COLLEGE INC,233 SW 16TH ST,,BELLE GLADE,334302821,5614637127,
PALM BEACH,3970,CHILDREN'S ACADEMY OF LAKE WORTH,CHILDREN'S ACADEMY OF LAKE WORTH,5891 S MILITARY TRAIL SUITE 19,,LAKE WORTH,33463,5615148104,
PALM BEACH,1976,"FAMILY CENTRAL, INC.",COURTNEY FOBBS LEARNING ACADEMY LLC,1020 W 25TH ST,,RIVIERA BEACH,33404,5613292419,
PALM BEACH,2015,CREATIVE LEARNING EXPERIENCE,CREATIVE LEARNING EXPERIENCE,3851 MILLER ROAD,,LAKE WORTH,334613649,5619691543,
PALM BEACH,4844,CREATIVE MONTESSORI ACADEMY LLC,CREATIVE MONTESSORI ACADEMY LLC,10045 BELVEDERE ROAD,,ROYAL PALM BEACH,334113184,5617535688,
PALM BEACH,1976,"FAMILY CENTRAL, INC.","EARLY LEARNING ACADEMY LANTANA, INC.",1969 LANTANA ROAD,,LANTANA,33462,5615880333,
PALM BEACH,6299,FIRST IMPRESSIONS OF BOYNTON II LLC,FIRST IMPRESSIONS OF BOYNTON II LLC,7053 HIGHRIDGE ROAD,,BOYNTON BEACH,334269305,5615855300,
PALM BEACH,6283,FIRST IMPRESSIONS OF BOYNTON III LLC,FIRST IMPRESSIONS OF BOYNTON III LLC,2214 S SEACREST BLVD.,,BOYNTON BEACH,331356787,5617374373,
PALM BEACH,6277,FIRST IMPRESSIONS OF BOYNTON LLC,FIRST IMPRESSIONS OF BOYNTON LLC,3520 OLD BOYNTON ROAD,,BOYNTON BEACH,334363914,5617342000,
PALM BEACH,2677,"CHILD CARE OF SOUTHWEST FL., INC.",FIRST IMPRESSIONS OF LAKE WORTH,3443 HYPOLUXO RD,,LAKE WORTH,33462,5616410474,
PALM BEACH,1976,"FAMILY CENTRAL, INC.",FIRST LEARNING ACADEMY II INC,1815 FOREST HILL BOULEVARD,,WEST PALM BEACH,33406,5614331142,
PALM BEACH,1976,"FAMILY CENTRAL, INC.","FIRST LEARNING ACADEMY, INC.",306 9TH ST.,,LAKE PARK,33403,5618421490,
PALM BEACH,649,FLORENCE FULLER CDC,"FLORENCE FULLER CHILD DEV. CTR., INC. WEST",10130 S. 185TH STREET,,BOCA RATON,33498,5614823006,
PALM BEACH,649,FLORENCE FULLER CDC,"FLORENCE FULLER CHILD DEVELOPMENT CENTER, INC",200 N.E. 14TH STREET,,BOCA RATON,33432,5613917274,
PALM BEACH,649,FLORENCE FULLER CDC,"FLORENCE FULLER CHILD DEVELOPMENT CENTERS, INC. - VOLEN CENTER",1515 W. PALMETTO PARK ROAD,,BOCA RATON,33486,5615088872,
PALM BEACH,5953,FOR THE CHILDREN INC,FOR THE CHILDREN INC,1718 S DOUGLAS STREET,,LAKE WORTH,334605514,5614931190,
PALM BEACH,3409,FORTIN FAMILY DEVELOPMENT CENTER,FORTIN FAMILY DEVELOPMENT CENTER,110 HARRELLE DR.,,SOUTH BAY,334932018,5619966871,
PALM BEACH,5534,FUTURE KIDS AT WEST PALM BEACH,FUTURE KIDS AT WEST PALM BEACH,3301 GUN CLUB ROAD,,WEST PALM BEACH,334063007,5616826543,
PALM BEACH,4663,FUTURE KIDS,FUTURE KIDS OF PALM BEACH,5765 LANTANA RD,,LAKE WORTH,334636703,5614327887,
PALM BEACH,5616,"FUTURE STARS CHILDREN'S ACADEMY, INC.","FUTURE STARS CHILDREN'S ACADEMY, INC.",5738-50 FOREST HILL BLVD.,,WEST PALM BEACH,334155510,5613129705,
PALM BEACH,6272,GARDENIA CHILDREN,GARDENIA CHILDREN LLC,1120 13TH STREET,,WEST PALM BEACH,334012402,5613185637,
PALM BEACH,6366,GENIUSVILLE ACADEMY,GENIUSVILLE ACADEMY,1127 48TH STREET,,MANGONIA PARK,334072301,5618421230,
PALM BEACH,3547,"GLOBAL LEARNING CHILD DEVELOPMENT CENTERS, INC","GLOBAL LEARNING CHILD DEVELOPMENT CENTERS, INC.",3142 FORD RD.,,LAKE WORTH,334612416,5619643000,
PALM BEACH,3545,GLOBAL LEARNING OF BOCA RATON,GLOBAL LEARNING OF BOCA RATON,1683 NW 15TH VISTA,,BOCA RATON,334321550,5613685255,
PALM BEACH,3546,GLOBAL LEARNING OF LAKE WORTH,GLOBAL LEARNING OF LAKE WORTH,544 SUNRISE COURT,,LAKE WORTH,334604350,5615330435,
PALM BEACH,4697,GLOBAL LEARNING OF PALM SPRINGS INC,GLOBAL LEARNING OF PALM SPRINGS INC,3846 10TH AVE N.,,PALM SPRINGS,334612854,5619661897,
PALM BEACH,1976,"FAMILY CENTRAL, INC.",GREAT EXPECTATIONS CHILDCARE CORPORATION,4180 GUN CLUB RD.,,WEST PALM BEACH,33406,5614718108,
PALM BEACH,4205,GREENACRES LEARNING CENTER,GREENACRES LEARNING CENTER,3950 S 57TH AVE,,GREENACRES,334634709,5614339331,
PALM BEACH,1976,"FAMILY CENTRAL, INC.",GROWING MINDS PREP ACADEMY LLC,920 TOWNHALL AVENUE,,JUPITER,33458,5617445874,
PALM BEACH,1798,"HIGHLAND FOOD RESOURCES, INC.","HANDS ON LEARNING CENTER, INC.",11367 OKEECHOBEE BLVD,,ROYAL PALM BEACH,33411,5617911131,
PALM BEACH,6399,HAPPY KIDZ LEARNING CENTER II LLC,"HAPPY KIDZ LEARNING CENTER II, LLC",2746 LAKE AVE,,WEST PALM BEACH,334051118,5618335996,
PALM BEACH,6667,HAPPY KIDZ LEARNING CENTER III LLC,HAPPY KIDZ LEARNING CENTER III LLC,724 BUNKER ROAD,,WEST PALM BEACH,334053504,5613289146,
PALM BEACH,6675,HAPPY KIDZ LEARNING CENTER IV LLC,HAPPY KIDZ LEARNING CENTER IV LLC,4350 TELLIN AVE,,WEST PALM BEACH,334064099,5616283190,
PALM BEACH,5756,HAPPY KIDZ LEARNING CENTER LLC,HAPPY KIDZ LEARNING CENTER LLC,3501 GEORGIA AVE,,WEST PALM BEACH,334051832,5614699541,
PALM BEACH,4867,IMAGINATION KIDZ LEARNING CENTER INC.,IMAGINATION KIDZ LEARNING CENTER INC.,1063 N HAVERHILL RD,,WEST PALM BEACH,334175844,5612420020,
PALM BEACH,6597,INSPIRING KIDS ACADEMY LLC,INSPIRING KIDS ACADEMY LLC,16245 OKEECHOBEE BLVD,,LOXAHATCHEE,334704104,5617901780,
PALM BEACH,6725,INSPIRING KIDS ACADEMY WPB LLC,INSPIRING KIDS ACADEMY WPB LLC,1679 SKEES RD,,WEST PALM BEACH,334112637,5616409120,
PALM BEACH,1976,"FAMILY CENTRAL, INC.",INTERNATIONAL KIDS ZONE,2400 N HAVERHILL ROAD,,WEST PALM BEACH,33417,5616409360,
PALM BEACH,1976,"FAMILY CENTRAL, INC.",INTERNATIONAL KIDS ZONE,4739 45TH STREET,,WEST PALM BEACH,33407,5616865444,
PALM BEACH,1976,"FAMILY CENTRAL, INC.",INTERNATIONAL KIDS ZONE,8289 OKEECHOBEE BLVD,,WEST PALM BEACH,33411,5613185750,
PALM BEACH,1976,"FAMILY CENTRAL, INC.",KALEIDOSCOPE PRESCHOOL CENTER INC,2821 PINEWOOD AVE,,WEST PALM BEACH,33407,5615136322,
PALM BEACH,1976,"FAMILY CENTRAL, INC.","KID'S COLLEGE PRESCHOOL, LLC",3644 10 AVENUE N,,PALM SPRINGS,33461,5618993501,
PALM BEACH,6747,"KIDDIE HAVEN PRE-SCHOOL, INC.","KIDDIE HAVEN PRE-SCHOOL, INC",2783 GULFSTREAM ROAD,,LAKE WORTH,334611811,5619678121,
PALM BEACH,3329,"KIDS 'R' KREATIVE LEARNING CENTER, INC.","KIDS 'R' KREATIVE LEARNING CENTER, INC.",4480 S TIFFANY DRIVE,,WEST PALM BEACH,33407,5612962462,
PALM BEACH,1976,"FAMILY CENTRAL, INC.",KIDS COLLEGE PRESCHOOL JOG,1091 S JOG ROAD,,GREENACRES,33415,5617662046,
PALM BEACH,5367,KIDSTOWN LEARNING CENTER,KIDSTOWN LEARNING CENTER,6995 CHARLESTON SHORES BLVD,,LAKE WORTH,334677675,5616417555,
PALM BEACH,1976,"FAMILY CENTRAL, INC.","KIDZ EXPLORATION CENTER FOR EARLY DEVELOPMENT, INC",311 W. FIRST ST.,,JUPITER,33458,5617471449,
PALM BEACH,1976,"FAMILY CENTRAL, INC.","KIDZ HOME ACADEMY, LLC",241 CYPRESS DRIVE,,WEST PALM BEACH,33403,5618485275,
PALM BEACH,1798,"HIGHLAND FOOD RESOURCES, INC.",KIDZ KALEIDOSCOPE PREP SCHOOL INC,1027 W 26TH STREET,,RIVIERA BEACH,33404,5616569731,
PALM BEACH,277,KINDERCARE LEARNING CENTERS LLC,KINDERCARE LEARNING CENTER #301728,4947 LE CHALET BLVD,,BOYNTON BEACH,33436,5617347412,
PALM BEACH,277,KINDERCARE LEARNING CENTERS LLC,"KINDERCARE LEARNING CENTERS, LLC 301333",3220 COMMERCE PLACE,,WEST PALM BEACH,33407,5616870595,
PALM BEACH,277,KINDERCARE LEARNING CENTERS LLC,"KINDERCARE LEARNING CENTERS, LLC 301390",3035 JOG RD,,LAKE WORTH,33467,5616417435,
PALM BEACH,4498,KINGSWOOD ACADEMY,KINGSWOOD ACADEMY,3307 S. JOG ROAD,,LAKE WORTH,334672010,5616491109,
PALM BEACH,4337,KINGSWOOD ACADEMY GREENACRES,KINGSWOOD ACADEMY GREENACRES,5445 10TH AVE N,,GREENACRES,334632056,5619677411,
PALM BEACH,5058,KINGSWOOD ACADEMY OF PALM SPRINGS,KINGSWOOD ACADEMY OF PALM SPRINGS,4137 S CONGRESS AVENUE,,LAKE WORTH,334614730,5619699200,
PALM BEACH,1976,"FAMILY CENTRAL, INC.",KLEVER KIDS LEARNING ACADEMY,4317 NORTHSHORE PLAZA,,WEST PALM BEACH,33407,5615418685,
PALM BEACH,1976,"FAMILY CENTRAL, INC.","KREATIVE KIDS OF LAKE WORTH, INC.",3643 10TH AVENUE NORTH,,LAKE WORTH,33461,5619691142,
PALM BEACH,1348,LA PETITE ACADEMY,LA PETITE ACADEMY #7385,10190 CALLE COMMERCIO,,BOCA RATON,33428,8614876021,
PALM BEACH,1348,LA PETITE ACADEMY,LA PETITE ACADEMY INC # 7384,4885 WINDWARD PASSAGE DR.,,BOYNTON BEACH,33436,5617360011,
PALM BEACH,1348,LA PETITE ACADEMY,LA PETITE ACADEMY INC # 7392,153 SPARROW DR,,ROYAL PALM BEACH,33411,5617902949,
PALM BEACH,5046,LEARNING WONDERLAND PRESCHOOL,LEARNING WONDERLAND PRESCHOOL,3092 FOREST HILL BLVD,,PALM SPRINGS,334065907,5618029090,
PALM BEACH,1860,"LIFE SPAN OF PALM BEACH COUNTY, INC","LIFE SPAN OF PALM BEACH COUNTY, INC.",1400 N. CONGRESS AVE,,RIVIERA BEACH,33404,5618821724,
PALM BEACH,3322,LIL KINGS & QUEENS ACADEMY II,LIL KINGS & QUEENS ACADEMY II,1115 13TH STREET,,WEST PALM BEACH,334012401,5612948691,
PALM BEACH,3969,LIL KINGS & QUEENS ACADEMY INC,LIL KINGS & QUEENS ACADEMY INC,1116 13TH ST,,WEST PALM BEACH,334012402,5618059482,
PALM BEACH,5372,LITTLE ANGELS DAYCARE & LEARNING CENTER LLC,LITTLE ANGELS DAYCARE & LEARNING CENTER LLC,2927 RANCH HOUSE RD,,WEST PALM BEACH,334063161,5616897310,
PALM BEACH,2524,LITTLE ANGELS LEARNING CENTER,LITTLE ANGELS LEARNING CENTER,2421 AVENUE E.,,RIVIERA BEACH,334044436,5614082395,
PALM BEACH,3974,LITTLE ANGELS LEARNING CENTER II,LITTLE ANGELS LEARNING CENTER II,1671 W. 15TH STREET,,RIVIERA BEACH,334045203,5618484322,
PALM BEACH,6672,LITTLE ANGELS PRE-SCHOOL ACADEMY,LITTLE ANGELS PRE-SCHOOL ACADEMY,4551 SUMMIT BOULEVARD,,WEST PALM BEACH,334153944,5616198099,
PALM BEACH,5676,"LITTLE BEGINNINGS ACADEMY, LLC","LITTLE BEGINNINGS ACADEMY, LLC",391 VALLEY FORGE RD.,,WEST PALM BEACH,334054036,5615850032,
PALM BEACH,1976,"FAMILY CENTRAL, INC.",LITTLE BLOSSOMS LEARNING CENTER,3700 GREENWOOD AVENUE,,WEST PALM BEACH,33407,5618441730,
PALM BEACH,1976,"FAMILY CENTRAL, INC.",LITTLE BLUE ACADEMY,2423 S CONGRESS AVE,,PALM SPRINGS,33406,5619659899,
PALM BEACH,1976,"FAMILY CENTRAL, INC.",LITTLE CUB'Z LEARNING CENTER LLC,144 SE 27TH AVE,,BOYNTON BEACH,33435,5617385262,
